url,uuid,langcode,revision_timestamp,status,title,created,changed,promote,default_langcode,revision_translation_affected,content_translation_source,field_collection_number,field_date_available,field_date_published,field_dspace_item_id,field_extent,field_finding_aid,field_unique_id,field_abstract,field_access_rights,field_access_terms,field_contributor,field_copyright_and_use,field_digital_publisher,field_genre,field_language,field_member_of,field_model,field_publisher_country,field_resource_type,field_subject,field_title_language,field_date_copyrighted,field_description,field_date_created
https://digital.library.jhu.edu/node/128,aab97ac1-cbd8-4706-8ad7-05e7a7887612,en,2022-03-11T14:37:38+00:00,True,Oral history of Warren Moos,2022-03-11T14:37:38+00:00,2022-03-11T14:37:38+00:00,True,True,True,und,MS.0404,2016-09-12,2015-04-01,d3aa3ed9-238e-4224-9843-84f12d62ec41,00:45:26 hh:mm:ss,https://aspace.library.jhu.edu/repositories/3/resources/400,0e8b718a-5556-400d-bd8a-50c2692821c5,"Warren Moos graduated from Brown University in 1957 and received a PhD in physics from the University of Michigan in 1962. From 1961 to 1963, he was a postdoctoral researcher at Stanford University, becoming an acting assistant professor in 1963. He joined the Department of Physics and Astronomy at Johns Hopkins in 1964, where he has served as director of the Center for Astrophysical Sciences and as chair of the Department of Physics and Astronomy. In this oral history, Moos discusses major projects and programs during his career at Johns Hopkins University. This oral history is part of the Hopkins Retrospective oral histories series.",62cfdefb-9b9a-4039-980b-ef8048fb0c1b,ced3af6c-fa7c-43a0-98a3-9a0be2bb2b46,relators:ivr:34d6aac3-e940-404a-ad31-2b6fb7c9ab41||relators:ive:f5d83400-c0a2-4156-b196-e7cd33b178d1,b13a7bd3-36ed-4838-a661-d2edd4c7924e,5fde104c-f1d8-440d-8578-ff28c1a9fbd0,558304c7-bb93-46e9-aee2-940aedf680bc||4bda73c2-1ed7-430a-9558-895be5ae119e,c5437b6e-77d8-4a23-9dc9-f549b5a4f9aa,58248e1c-533b-45b2-85c7-a0bf0751e855,2d0d469a-4ae1-470c-93cf-c912f430e20c,e3196586-4f7e-4373-a2f6-e5fb4d48621f,7c84ddc6-ad1d-4fe8-a4ee-2cf1bdcea33d||90de57a9-34d2-4a57-8446-83887f13da6d,a9604899-8520-47aa-b7ae-166662c7f619||a9702cf5-1aca-4b2f-bb34-246ddf047dd9||134ca6a5-ed34-4773-9f71-e7d9564028b4||65825f61-4ee0-4331-9e04-f22cf7f32b01||fb99949c-528b-455c-9fb5-da669ee65795||52df55ce-3396-4108-9ee2-9d704372c10c||9f98e66b-c585-460d-a770-c290bef1f015||cbddca79-a42f-419f-a2c1-8cae91079f23||edb4114a-c3d2-4077-a682-2107e62c2d87||6c990725-a55b-446c-bcc6-dc109fab4f22||3f7d8c47-9143-4f18-91ef-1f808802dddf||ccc3636a-7341-4865-86f6-7980c35cce89||bd4ded1c-00bc-4f2f-80ec-1a84e3a2d264||f5d83400-c0a2-4156-b196-e7cd33b178d1||77dc06ca-d197-4e44-977b-5ebeb75b8c72||4fe2a690-747c-4a08-a707-8b3a41ff3c4c||96e652db-1a48-42d7-aaf2-0fc896bcd0b4||7961e658-a325-43fb-bc5b-b08ee5c457c9||a8535fbc-6484-43ef-b8cd-e71df33bcff8||25d81312-300b-4579-b45b-8227d3c01638||625c6215-ceec-4da8-a886-6e6995ffade8||8d3fc765-6813-4849-807a-29bf380fb10a||654b8cc6-d4c8-4f68-bbf0-73c58b9260a6||ed6c8ca5-07f4-4166-befd-5799d1d9d9b1||bb8fab58-99e1-440d-b465-a52a735eb5d0||370ee152-7d85-4d41-9ea4-f651d75ed59f||7ac10b2f-9801-470a-8366-351a2aa15f22,c5437b6e-77d8-4a23-9dc9-f549b5a4f9aa,,,
https://digital.library.jhu.edu/node/129,52a7f542-821f-44e9-bb2a-7eacd4847bf4,en,2022-03-11T14:37:38+00:00,True,Oral history of Bert Vogelstein,2022-03-11T14:37:38+00:00,2022-03-11T14:37:38+00:00,True,True,True,und,MS.0404,2015-09-10,1999-12-22,d48ca4b7-c595-45c0-9d80-85e4ec39aad7,00:33:53 hh:mm:ss,https://aspace.library.jhu.edu/repositories/3/resources/400,c8e85a5f-b03a-48ed-86f1-defef8570e2f,"Bert Vogelstein was born in Baltimore, Maryland. He received his undergraduate degree from the University of Pennsylvania and went on to receive his medical degree from the Johns Hopkins School of Medicine. He has served as the director of the Ludwig Center, a Clayton Professor of Oncology and Pathology, and a Howard Hughes Medical Institute Investigator for Johns Hopkins Medical Institutions. He is best known for his work in cancer genomics, and has studied human tumors extensively. In this history, Vogelstein discusses his work as a research doctor and his time at Hopkins. This oral history is part of the Mame Warren oral histories series.",62cfdefb-9b9a-4039-980b-ef8048fb0c1b,ced3af6c-fa7c-43a0-98a3-9a0be2bb2b46,relators:ivr:8d255a4c-ff1e-411b-86c4-a2614e41cbcc||relators:ive:cedf6c35-5155-4b0e-99ff-5d33090a0fed,b13a7bd3-36ed-4838-a661-d2edd4c7924e,5fde104c-f1d8-440d-8578-ff28c1a9fbd0,558304c7-bb93-46e9-aee2-940aedf680bc||4bda73c2-1ed7-430a-9558-895be5ae119e,c5437b6e-77d8-4a23-9dc9-f549b5a4f9aa,58248e1c-533b-45b2-85c7-a0bf0751e855,2d0d469a-4ae1-470c-93cf-c912f430e20c,e3196586-4f7e-4373-a2f6-e5fb4d48621f,7c84ddc6-ad1d-4fe8-a4ee-2cf1bdcea33d||90de57a9-34d2-4a57-8446-83887f13da6d,6b956982-9bf8-4d66-98ca-c67f9caa39e6||b24b7e00-2305-4488-bc45-c28d77aa2975||98246066-6e1e-47d1-a82a-1ad266dc1813||b616c7b4-f651-4c48-8766-1bead2b4a950||cedf6c35-5155-4b0e-99ff-5d33090a0fed||302b1e58-86fe-4594-b96d-886f0c506dba||6fda8740-9c75-45b3-96b1-cc1789df56da||659c4822-9356-47ba-8f9c-e984add3e4e7||f7aa3385-23cb-4ca0-a7a5-d521d15e33a9||58b177ea-fb9f-4d25-b4d4-2f05c57d7971||1156f528-1818-4db4-8a43-2665a1b886e1,c5437b6e-77d8-4a23-9dc9-f549b5a4f9aa,,,
https://digital.library.jhu.edu/node/130,c6116cc3-6ba0-45d7-b41d-0d341d4de6f9,en,2022-03-11T14:37:38+00:00,True,Oral history of Louise Cavagnaro,2022-03-11T14:37:38+00:00,2022-03-11T14:37:38+00:00,True,True,True,und,MS.0404,2015-08-10,1999-07-19,d7b41315-017e-4b83-ab14-e8230ba39c1f,02:19:13 hh:mm:ss,https://aspace.library.jhu.edu/repositories/3/resources/400,baa7f797-88e4-4518-a597-8161c5582fde,"Louise Cavagnaro, originally from Portland, Oregon, was a major figure in the history of the Johns Hopkins Hospital for the last half of the twentieth century. She served as an operating nurse in combat zones during World War II and the director of nursing in Hiroshima with the Atomic Bomb Casualty Commission, after which she earned an M.A. in Hospital Administration from Columbia University and came to work at Johns Hopkins Hospital in 1953. She filled many roles during her time teaching and administrating in the Hospital, as well as the School of Nursing. Most notably, it was Cavagnaro who led the charge to desegregate the Hospital and its affiliate institutions, about which she wrote a book in 1992 titled ""A History of Segregation and Desegregation at the Johns Hopkins Medical Institutions."" In this oral history, Cavagnaro describes the challenges of being a female in the male-dominated medical milieu of the 1950s, the Johns Hopkins Hospital and how it has changed over time, and the racial politics of the Hospital. This oral history is part of the Mame Warren oral histories series.",62cfdefb-9b9a-4039-980b-ef8048fb0c1b,ced3af6c-fa7c-43a0-98a3-9a0be2bb2b46,relators:ivr:8d255a4c-ff1e-411b-86c4-a2614e41cbcc||relators:ive:062d6f80-9cda-4fdc-898c-3fd78ce0a930,b13a7bd3-36ed-4838-a661-d2edd4c7924e,5fde104c-f1d8-440d-8578-ff28c1a9fbd0,558304c7-bb93-46e9-aee2-940aedf680bc||4bda73c2-1ed7-430a-9558-895be5ae119e,c5437b6e-77d8-4a23-9dc9-f549b5a4f9aa,58248e1c-533b-45b2-85c7-a0bf0751e855,2d0d469a-4ae1-470c-93cf-c912f430e20c,e3196586-4f7e-4373-a2f6-e5fb4d48621f,7c84ddc6-ad1d-4fe8-a4ee-2cf1bdcea33d||90de57a9-34d2-4a57-8446-83887f13da6d,2122182b-dcda-45ef-90e1-a6d410b6c001||7d167db2-2b3e-4bb9-91e4-b611272c04ac||6dbbede9-429c-413f-a155-be5bc09c2205||6b956982-9bf8-4d66-98ca-c67f9caa39e6||d796428f-f331-48a1-9ae1-13ad0829e155||08dd919a-7eec-4e55-a8fd-dd05327d6d33||88554e50-5a69-4bb3-8316-53b1b11b1d25||608b2f13-8ec2-42f8-8a99-7ca4f975e32d||0da45a4b-ec4c-4584-8113-3731c89af562||e36ab271-e88f-4598-b342-ad15f4c7314e||b28bae3f-6c38-48a0-8977-ca7a1a0dfb6a||97676a90-5f76-47dd-94f6-8f62be1d3fa9||e8a4170e-7f09-45d1-9771-52c04b3dea0f||f25e4870-c3d3-4c47-b30f-973b88813a0b||062d6f80-9cda-4fdc-898c-3fd78ce0a930||a85ffc65-4bfb-42e4-ac0f-181fe8585bb4||7f230774-2c16-4e19-8f86-becf67343fb7||de68caa9-6a4a-4605-9457-0d8652743cfe||6c0db5c5-fe34-4408-adc6-17da30855776||d06b3b39-ffc1-4973-85fd-ba64db37ac46||937822fc-4e6a-4864-8841-68bafa535408||01f1414e-17c2-483e-9139-a2210408dc3a||110284ba-3234-46d9-a89a-a9929a5e9a9f||98739ee7-d18a-465d-8d1e-3243209e088f||19dc75f9-0078-42b3-9e8d-d0e96210031c||499031aa-2d47-426d-a135-bdb9a0a8721a||fedfea2a-7044-4398-8391-0fc024a75755||05ebdcec-65c4-4cb3-a089-ac3df39cb652||1b8aa596-937a-4b35-873f-0dde9299f8b8||353de4c2-4bc7-4a28-a2d6-38080ca4586f||d58f01f7-9f18-4ef8-a065-31bd3cb4bfbe||447db214-62fe-4eaf-b990-14c7cfd3b0f8||6e12c9f6-7a60-4e0f-93ee-d1cfa47df57e||edeed2ec-d412-4e79-a870-cf3a29b8ebd7||c7676eb0-0bbc-40a8-8f82-e500d0c33e09||b2bd154a-6ed5-4c3c-8813-4438ef81dc8d||3f272ea4-db60-4b89-84e7-2f35d9c86391||16d0a4b6-3fb6-4ffe-bb41-a2049d45794e||42ac2b03-e4a9-4306-b1fc-e0a64d2e2e49||e1d0c6f0-3f27-4b7d-b0be-205919ebbd06||bb36b9b7-f24d-43e9-aa2b-e7b462467de1||6e925937-9970-4190-b8e8-263589aad7fb||8d96bfc5-eb08-4765-979a-8d296f418dd9||56ab53ef-16d6-477f-83fd-411c86ade0d5||9d66fbf9-eec4-4024-b47e-974ebae5e5c1,c5437b6e-77d8-4a23-9dc9-f549b5a4f9aa,,,
https://digital.library.jhu.edu/node/131,dbb6446c-2352-496f-9e73-b569d00ab3a5,en,2022-03-11T14:37:38+00:00,True,Oral history of Helen Holton,2022-03-11T14:37:38+00:00,2022-03-11T14:37:38+00:00,True,True,True,und,MS.0404,2015-08-24,1999-11-23,d806b587-c2a4-4f3b-bf2e-83fa06c4319c,00:58:43 hh:mm:ss,https://aspace.library.jhu.edu/repositories/3/resources/400,3650f3cd-8722-4619-9c7d-42911a49d539,"Helen Holton, a Baltimore native and longtime Baltimore City Council member, attended Johns Hopkins University, Morgan State University, and the University of Baltimore. She joined the Baltimore City Council in 1995, representing the 5th District of Baltimore, until she became the first representative of the new 8th District of Baltimore in 2004. Holton has served on numerous boards, commissions, councils, and committees for Maryland, Baltimore, regional affairs, her alma maters, and assorted service organizations. In addition to her political work, Holton is an Associate Pastor for Payne Memorial African Methodist Episcopal Church in Baltimore. In this oral history, Holton discusses the Leadership Development Program at Hopkins, the School of Professional Studies in Business and Education (SPSBE), her experiences as an African-American political official, and her work in Baltimore. This oral history is part of the Mame Warren oral histories series.",62cfdefb-9b9a-4039-980b-ef8048fb0c1b,ced3af6c-fa7c-43a0-98a3-9a0be2bb2b46,relators:ivr:8d255a4c-ff1e-411b-86c4-a2614e41cbcc||relators:ive:7002b491-fc6d-4ae0-b6a3-5ffa18102cbd,b13a7bd3-36ed-4838-a661-d2edd4c7924e,5fde104c-f1d8-440d-8578-ff28c1a9fbd0,558304c7-bb93-46e9-aee2-940aedf680bc||4bda73c2-1ed7-430a-9558-895be5ae119e,c5437b6e-77d8-4a23-9dc9-f549b5a4f9aa,58248e1c-533b-45b2-85c7-a0bf0751e855,2d0d469a-4ae1-470c-93cf-c912f430e20c,e3196586-4f7e-4373-a2f6-e5fb4d48621f,7c84ddc6-ad1d-4fe8-a4ee-2cf1bdcea33d||90de57a9-34d2-4a57-8446-83887f13da6d,0d63fc35-7612-46ca-a598-4475a273ac18||fb99949c-528b-455c-9fb5-da669ee65795||76e05005-58ca-41d9-9541-6b145269d4e5||dc2b717a-8cf6-4515-8970-c0f231a48cb7||e36ab271-e88f-4598-b342-ad15f4c7314e||3defd765-ddc9-4fa5-8d73-13b450309071||c162e6ab-3fd0-4411-9d01-ed5f3335dbe7||7d63e6b3-5d50-48d4-a76b-7e7e18829fb6||7002b491-fc6d-4ae0-b6a3-5ffa18102cbd||e63db118-5494-4c87-a575-7096fbbe4d74||edac10bc-4526-42e0-a8b1-199707995cd9||2477c204-ca35-4549-aac9-9d1191b9ba56||8dcb8645-97f8-47af-83fe-a67397523854||dd231a90-2d30-486d-b7cf-ff6dc9839c0a||5e4fb51e-2885-45e9-afda-fdb53ee42f3c||f82696f3-ab04-40f1-a44a-c8e133aa1dbb||15c18ebf-cf6e-4afb-b737-2d19e67e69f5||4624c20a-ade4-4f68-9234-d0b4eda1e1b8||f0d2f032-080d-4e0b-9cb4-9cd91162c04a||36d595b8-f33a-44c5-b14d-fb9219b5dfe8,c5437b6e-77d8-4a23-9dc9-f549b5a4f9aa,,,
https://digital.library.jhu.edu/node/132,aa3de647-4eea-4716-bcaa-27a3c31f2575,en,2022-03-11T14:37:38+00:00,True,Oral history of H.T.,2022-03-11T14:37:38+00:00,2022-03-11T14:37:38+00:00,True,True,True,und,MS.0404,2019-09-24,2019-03-04,d88f80e0-2756-4ee4-9808-27c5c6b80997,00:56:08 hh:mm:ss,https://aspace.library.jhu.edu/repositories/3/resources/400,59e9e26a-a793-4196-9a6f-c465c01bdb3d,"""H.T."" is a member of the Johns Hopkins University graduating class of 2019 and majored in neuroscience. In this interview, H.T. discusses growing up near the border of Texas and Mexico with their parents and three siblings, as well as their college application experience. H.T. describes their transition to life on campus away from family and what inspired them to study neuroscience. They also discuss participation in campus organizations such as the Latino Pre-Health Honor Society Lambda Epsilon Mu (LEM) and Johns Hopkins Underrepresented in Medical Professions (JUMP), as well as their year studying abroad in Spain. This oral history is part of the First-generation Students oral histories series.",62cfdefb-9b9a-4039-980b-ef8048fb0c1b,ced3af6c-fa7c-43a0-98a3-9a0be2bb2b46,relators:ivr:e7454ea2-621e-4704-8b66-69c2e0c17654||relators:ive:55201a5b-547d-4072-8884-41e99b8c9633,b13a7bd3-36ed-4838-a661-d2edd4c7924e,5fde104c-f1d8-440d-8578-ff28c1a9fbd0,558304c7-bb93-46e9-aee2-940aedf680bc||4bda73c2-1ed7-430a-9558-895be5ae119e,c5437b6e-77d8-4a23-9dc9-f549b5a4f9aa,58248e1c-533b-45b2-85c7-a0bf0751e855,2d0d469a-4ae1-470c-93cf-c912f430e20c,e3196586-4f7e-4373-a2f6-e5fb4d48621f,7c84ddc6-ad1d-4fe8-a4ee-2cf1bdcea33d||90de57a9-34d2-4a57-8446-83887f13da6d,55201a5b-547d-4072-8884-41e99b8c9633||fb99949c-528b-455c-9fb5-da669ee65795||52df55ce-3396-4108-9ee2-9d704372c10c||5bde972c-b776-426b-89d2-166435623536||4bb91c42-6923-4a57-885c-9317eff0b3cc||cbfec7f6-55c4-45c9-938e-67008f29ff9e||2b04073e-9a48-471b-b476-3264932f9516||e299cf70-dcdc-46a1-a58a-ac311e5213ca||e463eaca-09cc-49cb-ba3e-b3dcd4791ec1||1de1725e-ede8-41cf-ba9d-5b1cce911ccc||5cfa9d5c-cae7-4a1b-937a-5bd9d469281a||1be526c5-9505-4c15-b7a7-e44f5cc693e1||1ea1d5d1-23c2-4e53-bb58-a32fb8a77918||e627defc-4372-4e7c-aa4e-a6cfcb102db3||acc86f6b-f1be-402f-81b6-7753710aca77||4937ecbf-c936-485f-bc0a-b04a8c6c5145||e36ab271-e88f-4598-b342-ad15f4c7314e||1091c208-565e-471b-8c22-d56d28af01d4||7a3c6a61-fde3-46bc-9099-193ee10c12b1||73ddb388-f2da-4bbf-a39c-5c18e2e03d39||56e68ef0-984c-4893-a648-846764e1999d,c5437b6e-77d8-4a23-9dc9-f549b5a4f9aa,,,
https://digital.library.jhu.edu/node/133,85cf09c9-97ff-40ad-817b-fc5e8fb609ac,en,2022-03-11T14:37:38+00:00,True,Oral history of Naneen Neubohn,2022-03-11T14:37:38+00:00,2022-03-11T14:37:38+00:00,True,True,True,und,MS.0404,2015-09-04,2000-02-13,dd0c83e2-7415-4ce0-bdbd-b31e0f135806,01:05:00 hh:mm:ss,https://aspace.library.jhu.edu/repositories/3/resources/400,950945cb-8473-4d61-be2c-4ead4eb182f7,"Naneen Neubohn was born in New York City and earned her undergraduate degree from Smith College. After attending Smith College, Neubohn went on to earn her master's degree from Johns Hopkins School of Advanced International Studies (SAIS) in 1964 and earned yet another master's in 1974 from the Columbia Business School at Columbia University. Neubohn is perhaps best known for her work at Morgan Stanley, where she served as a financial director and later as a managing director. Throughout her career, Neubohn remained dedicated to SAIS, working as both a trustee and a career mentor. For her dedication, she was awarded the Johns Hopkins Heritage Award. In this history, Neubohn talks about her time in Bologna as a SAIS student, her thoughts on SAIS, and her time as a trustee. This oral history is part of the Mame Warren oral histories series.",62cfdefb-9b9a-4039-980b-ef8048fb0c1b,ced3af6c-fa7c-43a0-98a3-9a0be2bb2b46,relators:ivr:8d255a4c-ff1e-411b-86c4-a2614e41cbcc||relators:ive:b77c9b19-2ffe-4edf-91f0-7824e8567e23,b13a7bd3-36ed-4838-a661-d2edd4c7924e,5fde104c-f1d8-440d-8578-ff28c1a9fbd0,558304c7-bb93-46e9-aee2-940aedf680bc||4bda73c2-1ed7-430a-9558-895be5ae119e,c5437b6e-77d8-4a23-9dc9-f549b5a4f9aa,58248e1c-533b-45b2-85c7-a0bf0751e855,2d0d469a-4ae1-470c-93cf-c912f430e20c,e3196586-4f7e-4373-a2f6-e5fb4d48621f,7c84ddc6-ad1d-4fe8-a4ee-2cf1bdcea33d||90de57a9-34d2-4a57-8446-83887f13da6d,6f7cf7cf-e676-4d4d-8c6c-9473b172faa9||f17b2b5f-bd32-4210-b446-67bb39da8924||bd28971b-27bf-4995-af98-b6248f81eaf1||1aef3a04-ead7-40c2-b2a5-d3ee071c9593||d1ca4812-f570-4078-85a9-b0e4ae349a3d||2408be60-1dbf-4ea6-bd15-6c5386bdf13e||c491c32f-f49d-4ac8-bd29-ea48b7f1b59c||1e09d349-76c3-4d78-a8a8-94fccd1f769d||75d936eb-54d1-4318-9d5d-2fa6b145e200||b77c9b19-2ffe-4edf-91f0-7824e8567e23||e4155f26-037e-4414-99cf-ee53cfd712ff||935fd68b-35a4-48eb-adc5-0fd932b90df9||e33e6235-96bc-4cb7-bd3e-e7e55b07ff74||983d3b9e-5d1d-47c9-8bde-db95b76c5fb5||fa5f29f7-1e72-4f13-bf6d-962ebc76d2a8||6e0f3217-ec79-4cf1-9aa9-2dea8e9b40c4||36d595b8-f33a-44c5-b14d-fb9219b5dfe8,c5437b6e-77d8-4a23-9dc9-f549b5a4f9aa,,,
https://digital.library.jhu.edu/node/134,c24e1d86-0d80-4c82-ab6a-bf76d9dbed75,en,2022-03-11T14:37:38+00:00,True,Oral history of Charles Nicodemus,2022-03-11T14:37:38+00:00,2022-03-11T14:37:38+00:00,True,True,True,und,MS.0404,2016-02-10,2015-10-13,e038d35f-83fb-45a7-bab2-4914f8619273,01:27:43 hh:mm:ss,https://aspace.library.jhu.edu/repositories/3/resources/400,f2f17efc-95b8-46e3-9af1-8b30f32b51f6,"Charles Nicodemus graduated from Johns Hopkins in 1950 with a degree in business. During his time on campus, Nicodemus was an active member of both the Glee Club and SAC. After graduation, Nicodemus went to work for his family's business, the Robert Terry Garment Company and then The Mutual Insurance Company of Frederick County, of which he eventually became president. In this history, Charles Nicodemus recounts his experiences as a Hopkins student, especially in regard to his involvement on campus. This oral history is part of the Hopkins Retrospective oral histories series.",62cfdefb-9b9a-4039-980b-ef8048fb0c1b,ced3af6c-fa7c-43a0-98a3-9a0be2bb2b46,relators:ivr:6f48e9d9-cde2-4bf6-8257-b73d2f1de9b6||relators:ive:52ffed47-7131-4b94-964e-57581d149174,b13a7bd3-36ed-4838-a661-d2edd4c7924e,5fde104c-f1d8-440d-8578-ff28c1a9fbd0,558304c7-bb93-46e9-aee2-940aedf680bc||4bda73c2-1ed7-430a-9558-895be5ae119e,c5437b6e-77d8-4a23-9dc9-f549b5a4f9aa,58248e1c-533b-45b2-85c7-a0bf0751e855,2d0d469a-4ae1-470c-93cf-c912f430e20c,e3196586-4f7e-4373-a2f6-e5fb4d48621f,7c84ddc6-ad1d-4fe8-a4ee-2cf1bdcea33d||90de57a9-34d2-4a57-8446-83887f13da6d,fb99949c-528b-455c-9fb5-da669ee65795||c6e1690b-e358-4af4-8f1f-85e1a6b4f6b0||52ffed47-7131-4b94-964e-57581d149174||9b2d2eb9-8f96-4e93-bc78-702a76f54871||4bb91c42-6923-4a57-885c-9317eff0b3cc||cbfec7f6-55c4-45c9-938e-67008f29ff9e||ee4a4675-0c9e-4aed-bfe7-d5d00c0ae56f||96056aa9-8479-459e-8b62-02c1eb4f5f86||da66a781-773c-4a58-890f-45768b3ee00d||5bf0c104-a831-41f5-9b6d-2586b6015aec||ab4e3a0e-0c67-46fe-9a41-8d5179093b22||d6595934-87bc-4ad2-9721-d4821e8b2f30||9c88b408-dbac-4337-91f1-82be18f2f122||36d595b8-f33a-44c5-b14d-fb9219b5dfe8||2347774a-b493-4bd5-8d6f-d55c73dd65cb,c5437b6e-77d8-4a23-9dc9-f549b5a4f9aa,,,
https://digital.library.jhu.edu/node/135,5bc0efae-94b2-4ee0-a0c5-6e5eb227e50d,en,2022-03-11T14:37:38+00:00,True,Oral history of Richard Henry,2022-03-11T14:37:38+00:00,2022-04-05T13:15:13+00:00,True,True,True,und,MS.0404,2016-09-12,2015-04-15,e7d066eb-daa9-438c-ac4a-096ed2e25116,01:32:06 hh:mm:ss,https://aspace.library.jhu.edu/repositories/3/resources/400,5c0a7a8d-cc1f-48dc-aa37-d5a670f317a6,"Richard Henry is an Academy Professor in the Zanvyl Krieger School of Arts & Sciences at Johns Hopkins University, where he is also Research Professor in the Henry A. Rowland Department of Physics & Astronomy. He is also Director of the Maryland Space Grant Consortium. He earned his Ph.D. at Princeton University in 1967. In this oral history, Henry discusses his early interest in astronomy, the trajectory of his career, and the beginnings of the Space Telescope Science Institute at Johns Hopkins University. This oral history is part of the Hopkins Retrospective oral histories series.",62cfdefb-9b9a-4039-980b-ef8048fb0c1b,ced3af6c-fa7c-43a0-98a3-9a0be2bb2b46,relators:ivr:ec0b8753-bbbd-491e-b299-a9188d62566c||relators:ive:966f51d9-a811-4448-a1ec-4b156e747644,b13a7bd3-36ed-4838-a661-d2edd4c7924e,5fde104c-f1d8-440d-8578-ff28c1a9fbd0,558304c7-bb93-46e9-aee2-940aedf680bc||4bda73c2-1ed7-430a-9558-895be5ae119e,c5437b6e-77d8-4a23-9dc9-f549b5a4f9aa,58248e1c-533b-45b2-85c7-a0bf0751e855,2d0d469a-4ae1-470c-93cf-c912f430e20c,e3196586-4f7e-4373-a2f6-e5fb4d48621f,7c84ddc6-ad1d-4fe8-a4ee-2cf1bdcea33d||90de57a9-34d2-4a57-8446-83887f13da6d,036e7996-9cea-4923-b09c-4eaa48f2416a||a9604899-8520-47aa-b7ae-166662c7f619||6b09bf20-3b03-4f10-99e7-cbe2928ba451||490ca313-c533-4e5d-9be0-c4b51dd907b9||52df55ce-3396-4108-9ee2-9d704372c10c||1264d2ba-6b16-4965-a847-c9bff0707d53||ad0d3e43-1059-4957-a23d-d7627b15478f||97439b39-ba8f-4a44-a85f-143220c127ee||9f98e66b-c585-460d-a770-c290bef1f015||cbddca79-a42f-419f-a2c1-8cae91079f23||5d2157c6-2ee7-4560-a5cc-ce7e4c28dd99||f8f4315e-1548-46af-a11a-836c0a40b750||4d4f29ee-ad43-4374-a679-609621d4ff17||ccc3636a-7341-4865-86f6-7980c35cce89||9400b0b2-e654-40af-a038-9addc93bb07a||4b1a88c2-f58f-44f3-af14-059e4a1fd6f3||5c4262b6-50d6-4b81-94cb-855131dcced4||5efc265a-48b8-46f3-a51b-01627fb3adb4||4f5791f0-f63a-4a56-9060-6655374562ca||966f51d9-a811-4448-a1ec-4b156e747644||4da2f624-32eb-49ac-9af1-753f1874acb7||4c1f2a9a-592d-4606-9993-f45bc8f9112a||f5d83400-c0a2-4156-b196-e7cd33b178d1||1b9a4411-c956-4f0a-a1d5-1359343fddc5||77dc06ca-d197-4e44-977b-5ebeb75b8c72||4796aa24-1956-47cb-8a40-e5dc740c15e0||7961e658-a325-43fb-bc5b-b08ee5c457c9||64b9aa57-11b3-47ef-aa18-53ca091f429d||6cdf2a10-f7e0-4c85-8fdf-01986ebd7733||25d81312-300b-4579-b45b-8227d3c01638||6c206bff-9cf3-4c0a-bab7-2be5b52f0500||beaf81f5-7563-46c8-96e5-03dad62e8b72||51bee490-5d94-4533-afad-8fc18638f1cc||2f9983ca-696c-4d1c-938a-0adab2f946c3||4346e0d8-6daa-44a4-94e0-00063d439c96||1c4ee1eb-5295-4aff-9bb4-d6a7fa4b394c||47a7ce20-294d-476e-8201-582f7785954b||ac4effa0-857c-415a-90ac-1004351ff8d5,c5437b6e-77d8-4a23-9dc9-f549b5a4f9aa,,,
https://digital.library.jhu.edu/node/136,3fc9b263-1b2d-4681-94cb-61ea0b740a25,en,2022-03-11T14:37:38+00:00,True,Oral history of Gladys Burrell,2022-03-11T14:37:38+00:00,2022-03-11T14:37:38+00:00,True,True,True,und,MS.0404,2017-11-30,2017-06-15,e8c35b5f-efec-4480-a628-17b79c42446b,01:24:07 hh:mm:ss,https://aspace.library.jhu.edu/repositories/3/resources/400,3921b28a-67e5-471a-befd-7298fde60db3,"Gladys Burrell, known as ""Ms. Gladys"" to Johns Hopkins students and staff, was a longtime food services worker on the Homewood campus. After 47 years working on the Homewood campus, she retired in 2017 from her last position as a cashier for the Fresh Food Café. She was a longtime union representative with Unite Here Local 7. Aside from her contributions to on-campus dining, she formed friendships with many students. In this interview, she discusses her early life, family, and her time working for various food services contractors at Johns Hopkins University. This oral history is part of the Hopkins Retrospective oral histories series.",62cfdefb-9b9a-4039-980b-ef8048fb0c1b,ced3af6c-fa7c-43a0-98a3-9a0be2bb2b46,relators:ivr:6f48e9d9-cde2-4bf6-8257-b73d2f1de9b6||relators:ive:1ca29cf4-2d18-4e50-90a6-69c1b1861ed3,b13a7bd3-36ed-4838-a661-d2edd4c7924e,5fde104c-f1d8-440d-8578-ff28c1a9fbd0,558304c7-bb93-46e9-aee2-940aedf680bc||4bda73c2-1ed7-430a-9558-895be5ae119e,c5437b6e-77d8-4a23-9dc9-f549b5a4f9aa,58248e1c-533b-45b2-85c7-a0bf0751e855,2d0d469a-4ae1-470c-93cf-c912f430e20c,e3196586-4f7e-4373-a2f6-e5fb4d48621f,7c84ddc6-ad1d-4fe8-a4ee-2cf1bdcea33d||90de57a9-34d2-4a57-8446-83887f13da6d,1ca29cf4-2d18-4e50-90a6-69c1b1861ed3||fb99949c-528b-455c-9fb5-da669ee65795||dffcebed-7f32-458f-9351-4de5f25664a6||1efa4d2c-b05b-471f-a01a-4d7791ec1747||7eeee89e-62c7-41a8-98b6-4f549fe79bb3||b76b8b11-b76a-43a5-9ebd-fa06d3de44e4||487682e4-f344-478d-a8e2-8e8674fb1734||8186ef2a-698f-4e79-9d37-f18d6419addd||21484a93-8ae8-4329-bf92-3924c480abc0||a0a6ff5a-93b7-4536-9dd4-ef2c938ad715||d58aa6ed-8293-4e4f-853e-1fe4761bf43b||f095f99c-d664-46db-ab8b-cd8eeeb0f9f2||206be280-2752-44ff-9063-e69a04a4b7e2||24d285e6-ab74-4bc9-8060-30b5f8d52c25||c92fb12c-ab11-4ab6-ade9-af91f8a38f28||4d5d1d5c-6de7-491f-8695-93d483909933||e36ab271-e88f-4598-b342-ad15f4c7314e||f78afb2f-be53-4191-9074-746d7576b7e1,c5437b6e-77d8-4a23-9dc9-f549b5a4f9aa,,,
