url,uuid,langcode,revision_timestamp,status,title,created,changed,promote,default_langcode,revision_translation_affected,content_translation_source,field_collection_number,field_date_available,field_date_published,field_dspace_item_id,field_extent,field_finding_aid,field_unique_id,field_abstract,field_access_rights,field_access_terms,field_contributor,field_copyright_and_use,field_digital_publisher,field_genre,field_language,field_member_of,field_model,field_publisher_country,field_resource_type,field_subject,field_title_language,field_date_copyrighted,field_description,field_date_created
https://digital.library.jhu.edu/node/70,0fed347e-93dc-49da-80b0-d710e6965006,en,2022-03-11T14:37:38+00:00,True,Oral history of Jerry Schubel,2022-03-11T14:37:38+00:00,2022-04-05T13:15:13+00:00,True,True,True,und,MS.0404,2015-10-26,2014-05-23,5300b843-e08e-49b5-91f5-40d67c123af9,01:11:11 hh:mm:ss,https://aspace.library.jhu.edu/repositories/3/resources/400,4e0dc327-48b2-4875-970c-18183bef4e7b,"Jerry Schubel received his Ph.D. in Oceanography from Johns Hopkins University and an honorary doctorate from the Massachusetts Maritime Academy. He went on to serve as associate director of the Johns Hopkins Chesapeake Bay Institute and from 1974-1994 served as the dean of Stony Brook University's Marine Science Research Center. He is the President and CEO of the Aquarium of the Pacific. He has written extensively on science-management policy for ocean issues and sits on several boards, including National Oceanic and Atmospheric Administration’s (NOAA) Science Advisory Board, the Science Advisory Panel for California’s Ocean Protection Council, and the Board of Governors of the Savannah Ocean Exchange. In this oral history, he discusses the Chesapeake Bay Institute and his career in oceanography. This oral history is part of the Hopkins Retrospective oral histories series.",62cfdefb-9b9a-4039-980b-ef8048fb0c1b,ced3af6c-fa7c-43a0-98a3-9a0be2bb2b46,relators:ivr:f92d4481-ca44-421d-aa4d-b96f4e1d97e8||relators:ive:f23388d0-fe6f-424d-aa5f-4f324a4fedfb,b13a7bd3-36ed-4838-a661-d2edd4c7924e,5fde104c-f1d8-440d-8578-ff28c1a9fbd0,558304c7-bb93-46e9-aee2-940aedf680bc||4bda73c2-1ed7-430a-9558-895be5ae119e,c5437b6e-77d8-4a23-9dc9-f549b5a4f9aa,58248e1c-533b-45b2-85c7-a0bf0751e855,2d0d469a-4ae1-470c-93cf-c912f430e20c,e3196586-4f7e-4373-a2f6-e5fb4d48621f,7c84ddc6-ad1d-4fe8-a4ee-2cf1bdcea33d||90de57a9-34d2-4a57-8446-83887f13da6d,c6b9a58c-d7e0-4337-845c-81f5d1c28529||fb99949c-528b-455c-9fb5-da669ee65795||b1438b02-1019-4895-86f2-cc7af15ab2f6||70d34535-4c4a-4709-ae1a-6423d562198d||15ac0957-18aa-4dd8-9e28-bdae3f6463be||858788d7-a7fb-4ac6-9b41-96f006732664||72f1f67e-1360-4297-9047-e7ce39a6fed4||72ce9e39-246d-4c15-9bd8-415717e37e8c||472c0fda-5e7f-4a06-a49f-824cda862751||ebb48153-8cf8-4880-aa68-97015e239abc||393efd17-84ef-410c-b132-6046086fa861||6153aff7-9180-4786-88e2-d35a3c63364f||711d0740-07ac-46a3-9f84-9155533e1a9a||968ba966-73af-4fb1-911e-f988affb8b63||c7553638-9c06-42be-9cbf-41b88ec43adc||c702f56f-6080-40bf-a840-a311926babed||d67483fe-8dde-44c1-a534-ca6c1a9a8033||d4df8a23-cb05-4e3f-86fe-2946600bb8b4||8ea25777-498b-4233-a65b-f2302ac2019a||f23388d0-fe6f-424d-aa5f-4f324a4fedfb||8929c09f-5835-46bc-a3d7-aa74a83856f6||33ab57d4-c21a-4857-8e60-1e14622e959a||b2dca9ed-6be0-47a5-b86f-3dd50cdb8a22||2c36ae3e-8749-4699-adff-736348bf841e||3f9ff03f-ba77-4516-9d05-cba0440b1527||0c573a22-ecb6-4eb7-9b89-85a9eb3d21a7||615ecac4-4fff-4500-a8b9-d9f01493fb1a||28b3e008-06f2-4175-9f4e-a89e01dce70f||dd79289f-8249-4ba0-aa69-95366d5ffba9||ea303b94-6311-4c39-8eaa-ec8c8e7c5754||eb1a035e-f91e-46df-ac3b-71d827ede421||5b162ad0-6b84-4f9b-8a3c-402d9c103cf9||12c5c6e5-7f78-49fd-b192-2846972dbc04,c5437b6e-77d8-4a23-9dc9-f549b5a4f9aa,,,
https://digital.library.jhu.edu/node/71,a0d3b448-8d7c-4b55-a395-866947f91283,en,2022-03-11T14:37:38+00:00,True,Oral history of Shale Stiller,2022-03-11T14:37:38+00:00,2022-03-11T14:37:38+00:00,True,True,True,und,MS.0404,2015-10-29,2015-03-25,54b8b603-42fd-4213-af00-e87d6a8dbe18,02:03:58 hh:mm:ss,https://aspace.library.jhu.edu/repositories/3/resources/400,1bc48a3d-6874-41b3-8c82-8b0ab3f100fc,"After receiving a B.A. from Hamilton College and an LL.B. from Yale University, Shale Stiller received an M.L.A. from Johns Hopkins University in 1977. Stiller spent his entire legal career in Maryland, first as a Maryland Court of Appeals clerk and later with the firms Frank, Bernstein and DLA Piper. He has taught as an adjunct professor for more than 50 years in the University of Maryland Law School. Stiller also served as the president of the Harry and Jeanette Weinberg Foundation, and as a trustee of Johns Hopkins University and Johns Hopkins Medicine. He is also active in a number of philanthropic organizations. In this interview, Stiller recounts his time at Hopkins as a student and a trustee. This oral history is part of the Hopkins Retrospective oral histories series.",62cfdefb-9b9a-4039-980b-ef8048fb0c1b,ced3af6c-fa7c-43a0-98a3-9a0be2bb2b46,relators:ivr:6f48e9d9-cde2-4bf6-8257-b73d2f1de9b6||relators:ive:ebafaf05-fed3-458d-a5d1-69477c06a2c6,b13a7bd3-36ed-4838-a661-d2edd4c7924e,5fde104c-f1d8-440d-8578-ff28c1a9fbd0,558304c7-bb93-46e9-aee2-940aedf680bc||4bda73c2-1ed7-430a-9558-895be5ae119e,c5437b6e-77d8-4a23-9dc9-f549b5a4f9aa,58248e1c-533b-45b2-85c7-a0bf0751e855,2d0d469a-4ae1-470c-93cf-c912f430e20c,e3196586-4f7e-4373-a2f6-e5fb4d48621f,7c84ddc6-ad1d-4fe8-a4ee-2cf1bdcea33d||90de57a9-34d2-4a57-8446-83887f13da6d,20e37519-12fd-4173-a15e-b009333465f9||afbc97ca-4bbb-4766-8731-64862eead7d6||2fa4d087-f0fc-42c6-be78-8f13b333bec5||2905bbba-1c35-4142-b2c5-b762db4b38e1||8314235f-b4dd-4c89-9ebf-a84b1ef7cb5e||7d167db2-2b3e-4bb9-91e4-b611272c04ac||af2147df-23a8-4455-8446-129b9c4ddd8e||fb99949c-528b-455c-9fb5-da669ee65795||6f7cf7cf-e676-4d4d-8c6c-9473b172faa9||f17b2b5f-bd32-4210-b446-67bb39da8924||6b956982-9bf8-4d66-98ca-c67f9caa39e6||d31cc01c-6297-4409-ba84-8ba99149ba48||a60cc407-6383-4dce-8005-981bc0cd070b||5fde104c-f1d8-440d-8578-ff28c1a9fbd0||b6585506-ac1e-4a00-a126-0c3f496e2af9||ee92d599-11e7-43b9-98e5-7100832c5749||e36ab271-e88f-4598-b342-ad15f4c7314e||79847e84-e203-4db7-994d-f60949b0c400||175a6734-3921-4afa-a538-7b19d890be63||2d487b68-f63c-4182-b7f4-151fe77f3325||937822fc-4e6a-4864-8841-68bafa535408||b9b91737-121e-45d1-850e-ca89b3406d34||e28dd873-7f6f-401b-89e7-21415e9702d2||77dc06ca-d197-4e44-977b-5ebeb75b8c72||02557114-cf55-44d9-8615-9ae5b65b3e9c||e936d408-c0f1-4881-ab58-78d9b13b9d8a||12eb244f-d59e-4cae-a83b-d7100833edd2||8dcb8645-97f8-47af-83fe-a67397523854||104f1e39-2840-4443-83f8-335486c31846||12e22ea9-c1bd-42c6-b1e1-f379f97db52a||ebafaf05-fed3-458d-a5d1-69477c06a2c6||2e81db81-94d4-48d5-b304-1a9d6d6fde6e||8175594a-8417-4ab8-b766-0874dc2b0132||25f21c89-151d-470b-aef5-fe3ac58300c9||71365c1e-d34c-4b2e-876e-7e49b6861143||cbfec7f6-55c4-45c9-938e-67008f29ff9e||3f9ff03f-ba77-4516-9d05-cba0440b1527||e33e6235-96bc-4cb7-bd3e-e7e55b07ff74||e947b057-5c0d-4856-aeb9-f176190831c1||49b70c66-50d2-48c3-a3b1-7d70d7b708dd||cd12a9f4-b697-40a2-be19-a6b615f5323b||96b52472-7c46-4b3c-b7d1-5f9b9e3da408||9d08fb58-0326-48fe-8020-3be48ce511c1||ca9ecaab-8224-4860-bc6b-7d1dd1888c7f||afbeee63-a90e-44f3-8df5-09978dca3049||68ff70fd-38f3-4a41-852b-7e59fe8dbfbd||b4809086-f511-44fb-828d-2b23c4196310||440a9e37-5c01-4f44-bc46-922fd38163d2||36d595b8-f33a-44c5-b14d-fb9219b5dfe8||dac9b518-8852-4e15-9a9c-2bcc33902005,c5437b6e-77d8-4a23-9dc9-f549b5a4f9aa,,,
https://digital.library.jhu.edu/node/72,50241f9b-909c-4f1c-9db0-514d4ee95d20,en,2022-03-11T14:37:38+00:00,True,Oral history of Chester Wickwire,2022-03-11T14:37:38+00:00,2022-04-05T13:15:13+00:00,True,True,True,und,MS.0404,2015-09-10,1999-07-09,579aa27b-ab2c-425c-b043-9f14dcf8a533,02:31:38 hh:mm:ss,https://aspace.library.jhu.edu/repositories/3/resources/400,62ec687f-8f35-4b14-b600-994e3f27bfcc,"Chester Wickwire was born in Nebraska. He completed his undergraduate work at Union College and went on to earn a graduate degree from Yale Divinity School. Wickwire graduated in 1953, and was hired to work at Johns Hopkins University, eventually serving as University Chaplain. Wickwire was a social activist on campus and in the greater Baltimore community, advocating tirelessly for social justice and civil rights for all. In this interview, Wickwire discusses his time as Chaplain as well as his activism. This oral history is a part of the Mame Warren oral histories series.",62cfdefb-9b9a-4039-980b-ef8048fb0c1b,ced3af6c-fa7c-43a0-98a3-9a0be2bb2b46,relators:ivr:8d255a4c-ff1e-411b-86c4-a2614e41cbcc||relators:ive:fb82cf49-fd0f-4747-be45-441e908f0884,b13a7bd3-36ed-4838-a661-d2edd4c7924e,5fde104c-f1d8-440d-8578-ff28c1a9fbd0,558304c7-bb93-46e9-aee2-940aedf680bc||4bda73c2-1ed7-430a-9558-895be5ae119e,c5437b6e-77d8-4a23-9dc9-f549b5a4f9aa,58248e1c-533b-45b2-85c7-a0bf0751e855,2d0d469a-4ae1-470c-93cf-c912f430e20c,e3196586-4f7e-4373-a2f6-e5fb4d48621f,7c84ddc6-ad1d-4fe8-a4ee-2cf1bdcea33d||90de57a9-34d2-4a57-8446-83887f13da6d,f5af0191-42a6-4a78-927e-801e7c898613||c3d3aeac-5462-4d2e-ad4c-49ab85c33b5a||fb99949c-528b-455c-9fb5-da669ee65795||52df55ce-3396-4108-9ee2-9d704372c10c||6ecae8a6-d370-435d-a5bc-53b355bd4afd||d70d3e75-ca0c-41c0-b3fd-a607396a9a4b||95ecc369-968a-45fc-976b-01fd212b2232||de68caa9-6a4a-4605-9457-0d8652743cfe||00ca4529-75c4-4e49-bd53-7c8cef9baeb8||6c0db5c5-fe34-4408-adc6-17da30855776||e3b852a6-e248-483f-99e2-50f74d4e7506||492a79e4-996e-4027-88c5-a91efbbb1a3e||bfd0c5d3-a9c7-40af-bc11-d40165556bf6||ba5cdb3a-20e2-42f4-8f0d-2ffd9386a29a||77dc06ca-d197-4e44-977b-5ebeb75b8c72||382e2a5c-2957-4309-9d86-d8c4c6c55c80||b0c2889a-e716-415e-9554-150a91028b54||e1e3bf11-966a-4c97-ac76-8fbdce32c33d||fb82cf49-fd0f-4747-be45-441e908f0884||24a02d98-6621-4fcd-98e0-d965c3e26b22||0fa51eec-4ad7-431a-8839-6460f12eb39a||cbfec7f6-55c4-45c9-938e-67008f29ff9e||8a4ffb1c-83eb-4e07-b8c9-4bd130de25bd||2a016471-5b44-4952-8b04-c7cf9e4b5369||f7536da2-31f6-4d96-bc0b-39aa012aca9e||c2799360-4f16-4982-8386-f6517b35d69a||9c88b408-dbac-4337-91f1-82be18f2f122||e8e04353-3809-4e17-971e-fb353fc09548||dba546d7-32ff-420f-80be-f0f5305d79e8||b13f4ab9-b029-4897-bc04-b2fe61b6344e,c5437b6e-77d8-4a23-9dc9-f549b5a4f9aa,,,
https://digital.library.jhu.edu/node/73,8ee580f5-6d65-4c10-aeac-013f0ea48c1a,en,2022-03-11T14:37:38+00:00,True,Oral history of S.H.,2022-03-11T14:37:38+00:00,2022-03-11T14:37:38+00:00,True,True,True,und,MS.0404,2019-10-08,2019-03-06,59722aa6-5f55-4502-9593-bc76d903f72e,00:22:08 hh:mm:ss,https://aspace.library.jhu.edu/repositories/3/resources/400,b68825e5-73e0-4568-a7f9-405e34164631,"""S.H."" is a member of the Johns Hopkins University graduating class of 2019 and was a writing seminars major. In this interview, S.H. describes growing up in Pennsylvania in a close-knit family and the transition to life on their own in college. They discuss the importance of leaving the ""Hopkins bubble"" and getting involved in the greater Baltimore community while in school, specifically through their participation in a nonprofit organization called Writers in Baltimore Schools. S.H. reflects on their coursework, their experience as a first-generation student, and shares their plan to attend law school following graduation. This oral history is part of the First-generation Students oral histories series.",62cfdefb-9b9a-4039-980b-ef8048fb0c1b,ced3af6c-fa7c-43a0-98a3-9a0be2bb2b46,relators:ivr:e7454ea2-621e-4704-8b66-69c2e0c17654||relators:ive:a61cf178-8a56-4192-b1b0-ff4593967f7f,b13a7bd3-36ed-4838-a661-d2edd4c7924e,5fde104c-f1d8-440d-8578-ff28c1a9fbd0,558304c7-bb93-46e9-aee2-940aedf680bc||4bda73c2-1ed7-430a-9558-895be5ae119e,c5437b6e-77d8-4a23-9dc9-f549b5a4f9aa,58248e1c-533b-45b2-85c7-a0bf0751e855,2d0d469a-4ae1-470c-93cf-c912f430e20c,e3196586-4f7e-4373-a2f6-e5fb4d48621f,7c84ddc6-ad1d-4fe8-a4ee-2cf1bdcea33d||90de57a9-34d2-4a57-8446-83887f13da6d,fb99949c-528b-455c-9fb5-da669ee65795||e36ab271-e88f-4598-b342-ad15f4c7314e||e299cf70-dcdc-46a1-a58a-ac311e5213ca||5317c70c-82c2-403e-9472-48c1d4ef07a6||3ddee95a-d31a-4fe4-89c3-dc3ff83dbe79||beab46cb-9be5-451b-b45c-f5a8f4a75d87||fa080f1a-bca4-4a26-b8ac-554725b8c601||5317c70c-82c2-403e-9472-48c1d4ef07a6||89267e29-0635-4412-9610-4386deca5b20||71a16d49-ae88-4e5c-948b-849f2f2c5cef||57745edb-9870-4183-9baf-2a4935aff1d3||308b1d23-3e5b-47f1-b78f-c6d1ea4d77cd||ba4f9baa-dc41-427d-8e13-2dbbf60d2279||9db3c51d-f06f-4895-abeb-c69c7f5c78fd||3c32c36a-df50-4b58-88a2-80fa24bbca38||cbfec7f6-55c4-45c9-938e-67008f29ff9e||9e9ae145-a5a4-4a61-a359-f0e53e1bab5a,c5437b6e-77d8-4a23-9dc9-f549b5a4f9aa,,,
https://digital.library.jhu.edu/node/74,db14ca21-009e-4036-aacf-728e0b2c45fc,en,2022-03-11T14:37:38+00:00,True,Oral history of Stella Shiber,2022-03-11T14:37:38+00:00,2022-03-11T14:37:38+00:00,True,True,True,und,MS.0404,2015-09-10,1999-11-22,5a65a35c-aac0-4cef-9dba-00f5f887babe,01:22:16 hh:mm:ss,https://aspace.library.jhu.edu/repositories/3/resources/400,88ba55e9-10bf-42f8-abec-51847d30e574,"Stella Shiber is a nurse whose career began in Tennessee. After working as a charge nurse, Shiber went on to become both an educator and administrator for nursing students. She has had a great impact on Hopkins nursing, helping to influence the curriculum at the School of Nursing and establishing health care clinics for poverty-stricken Baltimore neighborhoods. In this history, Shiber discusses her experiences with Hopkins nursing. This oral history is part of the Mame Warren oral histories series.",62cfdefb-9b9a-4039-980b-ef8048fb0c1b,ced3af6c-fa7c-43a0-98a3-9a0be2bb2b46,relators:ivr:8d255a4c-ff1e-411b-86c4-a2614e41cbcc||relators:ive:6bead2bb-20fd-4ab8-86ec-356358bbf3c0,b13a7bd3-36ed-4838-a661-d2edd4c7924e,5fde104c-f1d8-440d-8578-ff28c1a9fbd0,558304c7-bb93-46e9-aee2-940aedf680bc||4bda73c2-1ed7-430a-9558-895be5ae119e,c5437b6e-77d8-4a23-9dc9-f549b5a4f9aa,58248e1c-533b-45b2-85c7-a0bf0751e855,2d0d469a-4ae1-470c-93cf-c912f430e20c,e3196586-4f7e-4373-a2f6-e5fb4d48621f,7c84ddc6-ad1d-4fe8-a4ee-2cf1bdcea33d||90de57a9-34d2-4a57-8446-83887f13da6d,c8b87ec5-f8a2-4d6f-98bf-4a1a836f02ce||c159fc90-1fe6-49cd-a587-294d9c1ef767||6dbbede9-429c-413f-a155-be5bc09c2205||d796428f-f331-48a1-9ae1-13ad0829e155||c41bccf7-53d7-49d6-9a06-5544fbcffee4||77dc06ca-d197-4e44-977b-5ebeb75b8c72||6bead2bb-20fd-4ab8-86ec-356358bbf3c0||cbfec7f6-55c4-45c9-938e-67008f29ff9e||e89f3259-3c22-474b-a8e9-a9c8e3eb367e||0dbee073-e2ce-4b11-8af8-b4049ba91ad5||16d0a4b6-3fb6-4ffe-bb41-a2049d45794e||d158ac02-af96-44ac-9200-d12e80db8e9f||32c643ab-abab-46b8-89ae-17b5a978d326||ca76dd7d-cc48-4b53-9e54-1b4c8f5e1081||ca76dd7d-cc48-4b53-9e54-1b4c8f5e1081||b7cce2ed-5252-470b-9679-724167a230c4||06bf2672-1f43-4d72-8444-cfc9ba83f1e6,c5437b6e-77d8-4a23-9dc9-f549b5a4f9aa,,,
https://digital.library.jhu.edu/node/75,a937597f-43fa-4b14-a746-95750aa3000a,en,2022-03-11T14:37:38+00:00,True,Oral history of Matthew Crenson,2022-03-11T14:37:38+00:00,2022-03-11T14:37:38+00:00,True,True,True,und,MS.0404,2015-10-26,2015-02-19,5cc0cd3e-eef6-4a1a-9301-66721468b147,01:19:56 hh:mm:ss,https://aspace.library.jhu.edu/repositories/3/resources/400,0a311297-5f54-4641-b28b-536c38ee3b5c,"Matthew Crenson graduated from Johns Hopkins in 1963 and went on to receive his Ph.D. in political science from the University of Chicago in 1967. He is currently a Professor Emeritus at Johns Hopkins University and has previously worked as the Faculty Director of the university's Baltimore Scholars Program and on the Homewood Institutional Review Board. In this history, Crenson discusses both his time as a student and professor at Hopkins. This oral history is part of the Hopkins Retrospective oral histories series.",62cfdefb-9b9a-4039-980b-ef8048fb0c1b,ced3af6c-fa7c-43a0-98a3-9a0be2bb2b46,relators:ivr:6f48e9d9-cde2-4bf6-8257-b73d2f1de9b6||relators:ive:90a62cee-0cd2-470d-a9c6-30b36b1ec0b8,b13a7bd3-36ed-4838-a661-d2edd4c7924e,5fde104c-f1d8-440d-8578-ff28c1a9fbd0,558304c7-bb93-46e9-aee2-940aedf680bc||4bda73c2-1ed7-430a-9558-895be5ae119e,c5437b6e-77d8-4a23-9dc9-f549b5a4f9aa,58248e1c-533b-45b2-85c7-a0bf0751e855,2d0d469a-4ae1-470c-93cf-c912f430e20c,e3196586-4f7e-4373-a2f6-e5fb4d48621f,7c84ddc6-ad1d-4fe8-a4ee-2cf1bdcea33d||90de57a9-34d2-4a57-8446-83887f13da6d,0d63fc35-7612-46ca-a598-4475a273ac18||20e37519-12fd-4173-a15e-b009333465f9||6e8524b6-9e05-42a5-9b65-1831b47c93ab||ba518afa-34c0-4d89-b3dc-78ecea2b949f||393a85b8-66cc-40e2-b949-2f7ac1f883c2||fb99949c-528b-455c-9fb5-da669ee65795||e7f0c95b-4f62-4026-9596-52a2c59738b0||cd85dd7a-ec65-461a-a179-98f7698d42fc||0147f4fe-f0e9-4bfc-90ef-fea0ef7ba3c9||2ccefdeb-4d50-49d7-b325-88416d62fabc||48ec8354-9c1f-4c57-85b8-38e1410177e9||e36ab271-e88f-4598-b342-ad15f4c7314e||ff1ccd95-cf5b-4551-a31d-dadd10fd5dd3||23de67af-35d7-49a4-89d6-465a75b76931||79847e84-e203-4db7-994d-f60949b0c400||545ae27c-d586-41da-bf07-2f12dfd2c4ff||90a62cee-0cd2-470d-a9c6-30b36b1ec0b8||e22819b8-7ff4-47ca-a8d1-24953aadd1bc||6c0db5c5-fe34-4408-adc6-17da30855776||8c3eed80-ffa0-4cca-9b17-8e9d175d61bf||b39141f4-fb8e-498d-a801-1161961f7967||020d5477-8a1b-4f12-8fdf-1977c2ef1439||8b28d058-e7b9-4191-b9dc-248f0a89ba46||b3f30359-646a-4b96-9e4e-d4dde12c82ae||fb82cf49-fd0f-4747-be45-441e908f0884||b8716d8d-3b11-4b25-bfca-667bb3cba24b||c3aa7441-78d6-44f7-bea8-8f65d75b77f5||cbfec7f6-55c4-45c9-938e-67008f29ff9e||fa05fd91-098c-4999-a379-02cf72927869||3f9ff03f-ba77-4516-9d05-cba0440b1527||e947b057-5c0d-4856-aeb9-f176190831c1||8628faea-7e1a-4cbb-8f50-d8c4a26dd4c3||511c8ea7-f220-4ba3-bfa3-60828b6be75c||dac0ffd0-709e-43f2-853c-90ecb829567c||305908aa-7132-4900-9751-2099e6f3fd9a||5e6494a5-7d93-4f55-88d2-d6659ade5ddb||bbbe031a-d0bb-4e63-87e3-b28cbcc1f64b||0e48bff2-cdb5-45c8-b9d5-498e5cbad05d||36d595b8-f33a-44c5-b14d-fb9219b5dfe8||29cf54b3-b7cb-4557-b381-ff815c1224e1||8d96bfc5-eb08-4765-979a-8d296f418dd9,c5437b6e-77d8-4a23-9dc9-f549b5a4f9aa,,,
https://digital.library.jhu.edu/node/76,9862561c-159e-4897-983d-4e9bef453438,en,2022-03-11T14:37:38+00:00,True,Oral history of Elizabeth Schaaf,2022-03-11T14:37:38+00:00,2022-03-11T14:37:38+00:00,True,True,True,und,MS.0404,2015-09-10,1999-09-14,5d3d679f-806b-451c-932d-28b24176ea2a,01:21:34 hh:mm:ss,https://aspace.library.jhu.edu/repositories/3/resources/400,8e48b9f6-9a4d-4362-b439-1288341ad9e4,"Elizabeth Schaaf came to the Peabody Institute in 1965 as both a student, studying voice, and a staff member. She began working as a secretary in the Director's Office in 1982. Noticing a lack of proper documentation at the institute, she worked to secure grants and complete research in order to establish archives for the institute's records. In addition to documenting Peabody's history, Schaaf also created an archive for the history of music in Baltimore at Peabody. In this history, Schaaf recounts her time as both a staff member and a student as well as the development of the Peabody Collection. This oral history is part of the Mame Warren oral histories series.",62cfdefb-9b9a-4039-980b-ef8048fb0c1b,ced3af6c-fa7c-43a0-98a3-9a0be2bb2b46,relators:ivr:8d255a4c-ff1e-411b-86c4-a2614e41cbcc||relators:ive:f92247fb-01b9-45d3-91bb-e6198b458167,b13a7bd3-36ed-4838-a661-d2edd4c7924e,5fde104c-f1d8-440d-8578-ff28c1a9fbd0,558304c7-bb93-46e9-aee2-940aedf680bc||4bda73c2-1ed7-430a-9558-895be5ae119e,c5437b6e-77d8-4a23-9dc9-f549b5a4f9aa,58248e1c-533b-45b2-85c7-a0bf0751e855,2d0d469a-4ae1-470c-93cf-c912f430e20c,e3196586-4f7e-4373-a2f6-e5fb4d48621f,7c84ddc6-ad1d-4fe8-a4ee-2cf1bdcea33d||90de57a9-34d2-4a57-8446-83887f13da6d,ac31ad68-102b-42b2-b5fa-f0871df60cfa||fb99949c-528b-455c-9fb5-da669ee65795||a60cc407-6383-4dce-8005-981bc0cd070b||d31cc01c-6297-4409-ba84-8ba99149ba48||e36ab271-e88f-4598-b342-ad15f4c7314e||b821e4ea-8f3f-47aa-a877-a8b9e98653ad||39178c76-2f50-4745-8385-3d4d1d2d26f0||7a5fffef-f7b3-40b9-ad5e-bdc7674dc890||32314b74-2b76-4f0f-ae5b-06c46bc7b1e5||9a20992d-4490-4133-b4cc-840bff26440f||40d1ac65-afc4-4186-9b8c-548242160d55||77dc06ca-d197-4e44-977b-5ebeb75b8c72||0734f1d3-bf95-4e7d-aed6-e166cd7b20ab||0271d93b-550f-428a-b4c2-59fcaef0668a||b7ddb175-1720-4141-b110-7b576d15ef7f||f92247fb-01b9-45d3-91bb-e6198b458167||a1a07831-527b-4833-a905-9bcec421d7d6||ef5ad568-dc9f-40fe-8160-8f0dfe706d07||16d4eff0-772e-47da-beee-3fc519cf0253||f096548d-2fdb-4957-9825-c63c7f65d9b4||5f01346a-671f-4f9a-a7b6-bdd1c1c5bea6||ca9ac9bb-51fa-4f32-b89d-09d9d4c5e699||ea552cae-e84a-445b-9c35-5f2197258b91,c5437b6e-77d8-4a23-9dc9-f549b5a4f9aa,,,
https://digital.library.jhu.edu/node/77,423c3fbf-7f27-4069-9e66-9d99036ab2b0,en,2022-03-11T14:37:38+00:00,True,Oral history of Richard Ross,2022-03-11T14:37:38+00:00,2022-03-11T14:37:38+00:00,True,True,True,und,MS.0404,2015-09-10,2000-04-13,64b79b34-de4b-4827-b856-eb7332c35642,01:12:17 hh:mm:ss,https://aspace.library.jhu.edu/repositories/3/resources/400,a665afb2-7c42-4aa8-a091-d5d4bb2c8573,"Richard S. Ross was born in Richmond, Indiana. He began attending Harvard in 1942 and was able to enter Harvard Medical School shortly thereafter because of the accelerated program that had been made available as a result of World War II. He graduated cum laude and went on to take an internship on the Osler Medical Service at Johns Hopkins. After spending time in the Army Medical Corps and Harvard, Ross returned to Hopkins to take a position as a chief medical resident. Ross's expertise was in the field of cardiology, as he developed coronary cineangiography and was also asked to give an opinion on former President Richard Nixon's cardiovascular health prior to the Watergate hearings. In this history, Dr. Ross discusses his love for the Hopkins School of Medicine and his thoughts on the program's progress. This oral history is part of the Mame Warren oral history.",62cfdefb-9b9a-4039-980b-ef8048fb0c1b,ced3af6c-fa7c-43a0-98a3-9a0be2bb2b46,relators:ivr:8d255a4c-ff1e-411b-86c4-a2614e41cbcc||relators:ive:104f1e39-2840-4443-83f8-335486c31846,b13a7bd3-36ed-4838-a661-d2edd4c7924e,5fde104c-f1d8-440d-8578-ff28c1a9fbd0,558304c7-bb93-46e9-aee2-940aedf680bc||4bda73c2-1ed7-430a-9558-895be5ae119e,c5437b6e-77d8-4a23-9dc9-f549b5a4f9aa,58248e1c-533b-45b2-85c7-a0bf0751e855,2d0d469a-4ae1-470c-93cf-c912f430e20c,e3196586-4f7e-4373-a2f6-e5fb4d48621f,7c84ddc6-ad1d-4fe8-a4ee-2cf1bdcea33d||90de57a9-34d2-4a57-8446-83887f13da6d,10c269d7-9192-4ccb-8817-19d0a947fc97||7d167db2-2b3e-4bb9-91e4-b611272c04ac||37ce6be6-0139-438a-a972-8c7ba1521ebf||52df55ce-3396-4108-9ee2-9d704372c10c||6dbbede9-429c-413f-a155-be5bc09c2205||6b956982-9bf8-4d66-98ca-c67f9caa39e6||0690a9b3-e2de-4cb2-ac33-7105d491e918||c553b03b-f112-4649-a735-61e0d1248244||b28bae3f-6c38-48a0-8977-ca7a1a0dfb6a||846eb50a-c174-49a6-a772-d46651ef7e32||38988059-3627-4450-a889-77c384f42312||ca7055df-d993-4289-9fa7-809cf5499b73||a93cd498-f3ec-41c8-afe9-7a81a6141587||5cbebbd9-0333-4ce2-b799-8965d89d69b5||f0ebc333-020a-4b2f-bd60-943b81d2993b||b616c7b4-f651-4c48-8766-1bead2b4a950||02557114-cf55-44d9-8615-9ae5b65b3e9c||15f444c5-9359-430a-9001-38aa984d40f4||104f1e39-2840-4443-83f8-335486c31846||499031aa-2d47-426d-a135-bdb9a0a8721a||8a8a6e09-fd63-4d3e-ac4c-fa6afbf1bb83||d1f0efe5-3f6a-4a41-accc-c54e95b343d3||cf7ee7a7-35b5-4c8e-bb23-8fdcc06efcc1||55b647b8-8cba-4f53-b096-b310ec1f0c78||e4942c49-13b1-4057-bc2e-45ac2da01ca4||e89f3259-3c22-474b-a8e9-a9c8e3eb367e||edeed2ec-d412-4e79-a870-cf3a29b8ebd7||5dea8aae-9513-43ce-8968-94af928fec04||8dc69f55-83b2-4784-a5ae-2c897adbd1ed||8c03488c-5750-4448-b4b2-cff31d5f9ea6||cd2f0e98-187b-4d5a-8720-89a55927a211||f7aa3385-23cb-4ca0-a7a5-d521d15e33a9||610a47c3-a06f-4bbc-87e8-50397d0d8e45||bb36b9b7-f24d-43e9-aa2b-e7b462467de1||c2ef26ac-011d-4dba-9702-2cebd8ca0271||56ab53ef-16d6-477f-83fd-411c86ade0d5,c5437b6e-77d8-4a23-9dc9-f549b5a4f9aa,,,
https://digital.library.jhu.edu/node/78,8f33b855-7965-4d85-85c9-fffe5ba390bf,en,2022-03-11T14:37:38+00:00,True,Oral history of Minnie Hargrow,2022-03-11T14:37:38+00:00,2022-03-11T14:37:38+00:00,True,True,True,und,MS.0404,2015-08-24,1999-09-20,64e8e796-d011-4443-9f6a-a4f25d57a060,01:25:22 hh:mm:ss,https://aspace.library.jhu.edu/repositories/3/resources/400,fe051557-0c16-4b77-99e4-19e39b7ba049,"Minnie Hargrow, a North Carolina native, began working for Johns Hopkins in 1946 in the university's cafeteria. After more than three decades in that position, Hargrow was promoted to a position in the Office of the President of Johns Hopkins, at which point she became the assistant of president Steven Muller. She remained the assistant to the president under three more Hopkins presidencies until her retirement in 2007. In this oral history, she discusses her work in Levering Hall and the changes in administration she has witnessed in her long career at Hopkins. This oral history is part of the Mame Warren oral histories series.",62cfdefb-9b9a-4039-980b-ef8048fb0c1b,ced3af6c-fa7c-43a0-98a3-9a0be2bb2b46,relators:ivr:8d255a4c-ff1e-411b-86c4-a2614e41cbcc||relators:ive:ab488c95-5e1a-415a-a233-e4bf0566d314,b13a7bd3-36ed-4838-a661-d2edd4c7924e,5fde104c-f1d8-440d-8578-ff28c1a9fbd0,558304c7-bb93-46e9-aee2-940aedf680bc||4bda73c2-1ed7-430a-9558-895be5ae119e,c5437b6e-77d8-4a23-9dc9-f549b5a4f9aa,58248e1c-533b-45b2-85c7-a0bf0751e855,2d0d469a-4ae1-470c-93cf-c912f430e20c,e3196586-4f7e-4373-a2f6-e5fb4d48621f,7c84ddc6-ad1d-4fe8-a4ee-2cf1bdcea33d||90de57a9-34d2-4a57-8446-83887f13da6d,fb99949c-528b-455c-9fb5-da669ee65795||fd3de754-6e50-4b3a-96d2-de87e326056c||fd0219cf-28ce-4e8d-a6b9-607a49321986||175a6734-3921-4afa-a538-7b19d890be63||72ce9e39-246d-4c15-9bd8-415717e37e8c||de68caa9-6a4a-4605-9457-0d8652743cfe||80b98e57-b78d-4926-9cde-5a7899e893c5||ab488c95-5e1a-415a-a233-e4bf0566d314||5a591171-fb04-405c-b694-c45ee1ee57e8||4db50267-a222-4b4b-a889-56b03c81c29a||77dc06ca-d197-4e44-977b-5ebeb75b8c72||02557114-cf55-44d9-8615-9ae5b65b3e9c||8dcb8645-97f8-47af-83fe-a67397523854||067ae139-3c88-4e3f-a698-a31c79393404||fb82cf49-fd0f-4747-be45-441e908f0884||f82696f3-ab04-40f1-a44a-c8e133aa1dbb||e33e6235-96bc-4cb7-bd3e-e7e55b07ff74||8402f3bd-244b-40bc-b878-4224fd96beaa||f5ada1c9-784f-4aa3-9dff-11da780b3de3||3fb781ff-88ab-45d6-9ca6-330564e4b4e7||9e9ae145-a5a4-4a61-a359-f0e53e1bab5a||7eeee89e-62c7-41a8-98b6-4f549fe79bb3,c5437b6e-77d8-4a23-9dc9-f549b5a4f9aa,,,
