url,uuid,langcode,revision_timestamp,status,title,created,changed,promote,default_langcode,revision_translation_affected,content_translation_source,field_collection_number,field_date_available,field_date_published,field_dspace_item_id,field_extent,field_finding_aid,field_unique_id,field_abstract,field_access_rights,field_access_terms,field_contributor,field_copyright_and_use,field_digital_publisher,field_genre,field_language,field_member_of,field_model,field_publisher_country,field_resource_type,field_subject,field_title_language,field_date_copyrighted,field_description,field_date_created
https://digital.library.jhu.edu/node/96,c2bd4c60-79e6-4f2f-8874-095fa39f2b7a,en,2022-03-11T14:37:38+00:00,True,Oral history of M.E.,2022-03-11T14:37:38+00:00,2022-03-11T14:37:38+00:00,True,True,True,und,MS.0404,2020-08-28,2020-03-02,80c661d9-7758-40b9-be6d-5174861fd8f8,01:31:35 hh:mm:ss,https://aspace.library.jhu.edu/repositories/3/resources/400,2d7f37b3-ac7d-4eb5-b7c7-41345f844102,"“M.E.” is a member of the Johns Hopkins University graduating class of 2020. In this interview, M.E. describes growing up in the Haitian community of Miami after immigrating from Haiti as a child and her early interest in pursuing a career in healthcare. She shares about her participation in first-generation college student initiatives on campus and the development of her academic interest in studying the intersection of neuroscience and social sciences. M.E. also describes her experience being Black in Baltimore and how she’s adapted to living in the city during college, working in the community and attending live music performances.",62cfdefb-9b9a-4039-980b-ef8048fb0c1b,ced3af6c-fa7c-43a0-98a3-9a0be2bb2b46,relators:ivr:e7454ea2-621e-4704-8b66-69c2e0c17654||relators:ive:478b2e01-dfe0-4abe-b88b-8b1b90ab9f02,b13a7bd3-36ed-4838-a661-d2edd4c7924e,5fde104c-f1d8-440d-8578-ff28c1a9fbd0,558304c7-bb93-46e9-aee2-940aedf680bc||4bda73c2-1ed7-430a-9558-895be5ae119e,c5437b6e-77d8-4a23-9dc9-f549b5a4f9aa,58248e1c-533b-45b2-85c7-a0bf0751e855,2d0d469a-4ae1-470c-93cf-c912f430e20c,e3196586-4f7e-4373-a2f6-e5fb4d48621f,7c84ddc6-ad1d-4fe8-a4ee-2cf1bdcea33d||90de57a9-34d2-4a57-8446-83887f13da6d,478b2e01-dfe0-4abe-b88b-8b1b90ab9f02||f98e5e3f-929d-4c15-9725-2ffae6b76d39||fb99949c-528b-455c-9fb5-da669ee65795||4624c20a-ade4-4f68-9234-d0b4eda1e1b8||e299cf70-dcdc-46a1-a58a-ac311e5213ca||e92bc7d5-e575-4aea-bd52-30f35196c46f||2b04073e-9a48-471b-b476-3264932f9516||11b3ab12-0d34-4299-9129-c96130a65906||4937ecbf-c936-485f-bc0a-b04a8c6c5145||e36ab271-e88f-4598-b342-ad15f4c7314e||f639676d-fa5e-45a0-af90-8f2024d97230||e9d423ad-0f2d-4fda-bd33-87b8478762d2,c5437b6e-77d8-4a23-9dc9-f549b5a4f9aa,,,
https://digital.library.jhu.edu/node/97,8cad6100-e4c2-4c16-9e87-e0773653d7c1,en,2022-03-11T14:37:38+00:00,True,Oral history of Lonnie Carton,2022-03-11T14:37:38+00:00,2022-03-11T14:37:38+00:00,True,True,True,und,MS.0404,2017-06-30,2016-08-16,8173cb60-7ea0-4570-93d6-04a11b7da221,01:22:33 hh:mm:ss,https://aspace.library.jhu.edu/repositories/3/resources/400,e1de1257-1862-4516-9cac-cb0143dd04c6,"Dr. Lonnie Carton, a Baltimore native, received a B.S. from Johns Hopkins University in 1949. She went on to earn her M.Ed in Child Psychology from the University of Maryland and PhD in Educational Psychology from Penn State University. During her career as a family therapist and educational consultant, Dr. Carton also hosted a syndicated radio program for CBS Radio called ""Dr. Lonnie Carton in the Learning Center."" In this oral history interview, she describes her undergraduate education at Hopkins as one of only a few women attending as full-time students, as well as the development of her career and family. This oral history is part of the Hopkins Retrospective oral histories series.",62cfdefb-9b9a-4039-980b-ef8048fb0c1b,ced3af6c-fa7c-43a0-98a3-9a0be2bb2b46,relators:ivr:6f48e9d9-cde2-4bf6-8257-b73d2f1de9b6||relators:ive:8028a9e7-67e8-4742-bd45-c4f73996b7c4,b13a7bd3-36ed-4838-a661-d2edd4c7924e,5fde104c-f1d8-440d-8578-ff28c1a9fbd0,558304c7-bb93-46e9-aee2-940aedf680bc||4bda73c2-1ed7-430a-9558-895be5ae119e,c5437b6e-77d8-4a23-9dc9-f549b5a4f9aa,58248e1c-533b-45b2-85c7-a0bf0751e855,2d0d469a-4ae1-470c-93cf-c912f430e20c,e3196586-4f7e-4373-a2f6-e5fb4d48621f,7c84ddc6-ad1d-4fe8-a4ee-2cf1bdcea33d||90de57a9-34d2-4a57-8446-83887f13da6d,8028a9e7-67e8-4742-bd45-c4f73996b7c4||21bb2799-6d80-4206-a0fd-5f0325b784ba||0ed01942-995f-4701-a027-60355ff90da2||fb99949c-528b-455c-9fb5-da669ee65795||eb9b9a6a-6b09-4d57-962b-1b5ffdc41c8b||5166eae4-602a-4fc8-89ee-e9f95b543371||338d7739-1e9d-46e0-8304-f59747a5c16e||fa05fd91-098c-4999-a379-02cf72927869||e94187be-aa61-415d-9674-bcf4ff243002||3f00d1cd-3baf-45f7-ab63-7759062feb67||e12689a7-5e66-4763-8f97-6970b4c9620f||e36ab271-e88f-4598-b342-ad15f4c7314e,c5437b6e-77d8-4a23-9dc9-f549b5a4f9aa,,,
https://digital.library.jhu.edu/node/98,ac0f6d7b-20b9-40ed-a2c5-29be130784eb,en,2022-03-11T14:37:38+00:00,True,Oral history of Helen Blumberg,2022-03-11T14:37:38+00:00,2022-03-11T14:37:38+00:00,True,True,True,und,MS.0404,2015-08-05,1999-10-13,8223525a-b99b-4383-b435-5a6469da556e,01:38:58 hh:mm:ss,https://aspace.library.jhu.edu/repositories/3/resources/400,f956886f-170d-41b3-b5b8-7dee48a6e588,"Helen Blumberg, a Baltimore native, entered Hopkins as a sophomore in 1970 as part of Johns Hopkins' first class of female undergraduates in the School of Arts and Sciences. She graduated in 1973. In this oral history, she describes her lifelong connections to Hopkins, via her father who was himself an alumnus and the director of alumni relations in 1970, and her personal experiences as one of Hopkins first female undergraduates. She touches on Baltimore as a city, student unrest on campus, and feminism. This oral history is part of the Mame Warren oral histories series.",62cfdefb-9b9a-4039-980b-ef8048fb0c1b,ced3af6c-fa7c-43a0-98a3-9a0be2bb2b46,relators:ivr:8d255a4c-ff1e-411b-86c4-a2614e41cbcc||relators:ive:4f9ee18c-0216-49fb-b532-1c9191ccbffe,b13a7bd3-36ed-4838-a661-d2edd4c7924e,5fde104c-f1d8-440d-8578-ff28c1a9fbd0,558304c7-bb93-46e9-aee2-940aedf680bc||4bda73c2-1ed7-430a-9558-895be5ae119e,c5437b6e-77d8-4a23-9dc9-f549b5a4f9aa,58248e1c-533b-45b2-85c7-a0bf0751e855,2d0d469a-4ae1-470c-93cf-c912f430e20c,e3196586-4f7e-4373-a2f6-e5fb4d48621f,7c84ddc6-ad1d-4fe8-a4ee-2cf1bdcea33d||90de57a9-34d2-4a57-8446-83887f13da6d,ba518afa-34c0-4d89-b3dc-78ecea2b949f||fb99949c-528b-455c-9fb5-da669ee65795||6b956982-9bf8-4d66-98ca-c67f9caa39e6||47fc44be-ad78-437a-9be2-a6aed282f3aa||e48f0db3-86a6-48e0-9d15-83c0149c0a01||e36ab271-e88f-4598-b342-ad15f4c7314e||f8ed1877-f26b-4fa8-94fc-fb73076147a3||4f9ee18c-0216-49fb-b532-1c9191ccbffe||de68caa9-6a4a-4605-9457-0d8652743cfe||6c0db5c5-fe34-4408-adc6-17da30855776||bba0fedd-3dd1-426c-bd14-853b73fa0bfb||a39c49e5-2256-4d34-a7ba-f6be7b52e7a4||77dc06ca-d197-4e44-977b-5ebeb75b8c72||76c443e4-c9a4-4f2d-b1bf-8d491837c237||63c47345-bcbf-4711-99d9-473a8bb740f6||8be9cff3-7325-4158-8ce3-c464243ae09b||5bde972c-b776-426b-89d2-166435623536||149cb340-9946-4c7a-8d1f-537d10f93730||5aa0ae11-360a-4ceb-b6b1-9291a6116be6||da66a781-773c-4a58-890f-45768b3ee00d||dd04ca06-4aff-4d08-866f-822721c8c326||36d595b8-f33a-44c5-b14d-fb9219b5dfe8||8ba72106-c180-403d-81fd-02234132e515||8d96bfc5-eb08-4765-979a-8d296f418dd9||c0a9902e-d74b-44ee-9967-324d682188f3,c5437b6e-77d8-4a23-9dc9-f549b5a4f9aa,,,
https://digital.library.jhu.edu/node/99,7d3672bd-2b77-4d0a-9bb6-9388ed107a0b,en,2022-03-11T14:37:38+00:00,True,Oral history of J.C.,2022-03-11T14:37:38+00:00,2022-03-11T14:37:38+00:00,True,True,True,und,MS.0404,2018-10-30,2018-02-20,8453f1c6-596d-4728-a4a7-fd98d63a7227,01:16:17 hh:mm:ss,https://aspace.library.jhu.edu/repositories/3/resources/400,dcd2e83d-55e6-43fc-9a4a-fcab4df3819c,"""J.C."" is a member of the Johns Hopkins University graduating class of 2018. They majored in environmental science and minored in applied math and statistics. In this interview, J.C. discusses growing up in a small town in New Hampshire, transitioning to life at Johns Hopkins, and how their studies and work experiences have shaped their decision to pursue a PhD. This oral history is part of the First-generation Students oral histories series.",62cfdefb-9b9a-4039-980b-ef8048fb0c1b,ced3af6c-fa7c-43a0-98a3-9a0be2bb2b46,relators:ivr:e0fa7bd2-02ef-4585-8b9e-229182765904||relators:ive:8c00252a-0990-4af5-bca8-40b5920829b5,b13a7bd3-36ed-4838-a661-d2edd4c7924e,5fde104c-f1d8-440d-8578-ff28c1a9fbd0,558304c7-bb93-46e9-aee2-940aedf680bc||4bda73c2-1ed7-430a-9558-895be5ae119e,c5437b6e-77d8-4a23-9dc9-f549b5a4f9aa,58248e1c-533b-45b2-85c7-a0bf0751e855,2d0d469a-4ae1-470c-93cf-c912f430e20c,e3196586-4f7e-4373-a2f6-e5fb4d48621f,7c84ddc6-ad1d-4fe8-a4ee-2cf1bdcea33d||90de57a9-34d2-4a57-8446-83887f13da6d,8c00252a-0990-4af5-bca8-40b5920829b5||e08e5107-b5d5-495d-8c59-916234171c48||3e5b3d8c-c70a-4c4b-bfef-801b285dac14||fb99949c-528b-455c-9fb5-da669ee65795||e299cf70-dcdc-46a1-a58a-ac311e5213ca||aa3f4a3f-62eb-45cc-a722-e9f114399bf8||6f9c1266-b6d2-4d22-8cf1-e50a8e5adcc2||d66c0583-c7c5-44f7-add6-7b1f8c717b16||23f21b66-26c9-4ce2-8967-427e66facb5d||4937ecbf-c936-485f-bc0a-b04a8c6c5145||e36ab271-e88f-4598-b342-ad15f4c7314e||8797bb13-f2f5-4e99-93c3-f6f9714ce525,c5437b6e-77d8-4a23-9dc9-f549b5a4f9aa,,,
https://digital.library.jhu.edu/node/100,de9279c6-6c9a-41d8-936e-9f1add983d82,en,2022-03-11T14:37:38+00:00,True,Oral history of Linda Brody,2022-03-11T14:37:38+00:00,2022-03-11T14:37:38+00:00,True,True,True,und,MS.0404,2017-06-30,2015-12-10,869c84ec-4d6d-455f-a370-01df46f51264,01:06:54 hh:mm:ss,https://aspace.library.jhu.edu/repositories/3/resources/400,fe953800-1f66-42d6-b75f-1e3cc31f995e,"Dr. Linda Brody received her Ph.D. in Gifted Education and Learning Disabilities from Johns Hopkins. She co-founded the Center for Talented Youth's Diagnostic and Counseling Center and directs CTY's Study of Exceptional Talent. In her interview, she describes joining CTY in the mid-1970s, working with Julian Stanley on the Study of Mathematically Precocious Youth, and the evolution of CTY into a national program. This oral history is part of the Hopkins Retrospective oral histories series.",62cfdefb-9b9a-4039-980b-ef8048fb0c1b,ced3af6c-fa7c-43a0-98a3-9a0be2bb2b46,relators:ivr:f92d4481-ca44-421d-aa4d-b96f4e1d97e8||relators:ive:94d6ce03-49f0-42e7-86c0-8e05d00168bf,b13a7bd3-36ed-4838-a661-d2edd4c7924e,5fde104c-f1d8-440d-8578-ff28c1a9fbd0,558304c7-bb93-46e9-aee2-940aedf680bc||4bda73c2-1ed7-430a-9558-895be5ae119e,c5437b6e-77d8-4a23-9dc9-f549b5a4f9aa,58248e1c-533b-45b2-85c7-a0bf0751e855,2d0d469a-4ae1-470c-93cf-c912f430e20c,e3196586-4f7e-4373-a2f6-e5fb4d48621f,7c84ddc6-ad1d-4fe8-a4ee-2cf1bdcea33d||90de57a9-34d2-4a57-8446-83887f13da6d,f92d4481-ca44-421d-aa4d-b96f4e1d97e8||a96bc671-9317-4527-8dad-846cd1ad0a97||94d6ce03-49f0-42e7-86c0-8e05d00168bf||b788fd98-45ad-40d3-8b52-f50ee932aeda||2d57a929-ac98-46e0-aeaf-b90fb28067a6||c9ec104d-7d5f-4f55-8e63-7e8f32ae0fd3||7f707a8f-90ad-461d-8d5c-759471ab43a4||c83bbc0d-1377-45d4-b510-37e7719f9dc8||33d5edfa-fb44-4962-a686-502e85ce30e8||6dc6bfa9-33ce-46e4-8b3c-04f20b388b80||e94187be-aa61-415d-9674-bcf4ff243002||5b67d51c-5bf1-40c2-ba47-e364bffadc38||50eae441-f763-42e0-a657-d1396a088b45||e71a30cb-50b9-4828-a5e3-ae0c380a153c||05ab60bb-8e3d-4631-adb0-9c21c9e68835||08b26846-62fe-4d63-8662-b2fefc513d2c,c5437b6e-77d8-4a23-9dc9-f549b5a4f9aa,,,
https://digital.library.jhu.edu/node/101,397e3cfe-81cc-4a08-8d01-6237b5c2d924,en,2022-03-11T14:37:38+00:00,True,Oral history of Myron Weisfeldt,2022-03-11T14:37:38+00:00,2022-04-05T13:15:13+00:00,True,True,True,und,MS.0404,2016-02-11,2015-09-24,87dc8ca4-c6b2-404a-a270-d417b15463ad,01:03:33 hh:mm:ss,https://aspace.library.jhu.edu/repositories/3/resources/400,d63921e2-08c8-4539-b24e-2600ac7a08e8,"Dr. Myron ""Mike"" Weisfeldt attended Johns Hopkins as an undergraduate from 1960-1962, completing an accelerated medical school program. He then attended the Johns Hopkins School of Medicine, earning his M.D. in 1965. Weisfeldt went on to work as a physician at the hospital, an Assistant Professor of Medicine and, later, the Director of the Cardiology division at the Johns Hopkins School of Medicine. Dr. Weisfeldt was the William Osler Professor of Medicine and Chairman of the Department of Medicine at Johns Hopkins School of Medicine from 2001 to 2014. He was also Physician-in-Chief of the Johns Hopkins Hospital. In 1990, he served as President of the American Heart Association. In this interview, Weisfeldt discusses his time as a student, faculty member, administrator, and physician at Hopkins. This oral history is part of the Hopkins Retrospective oral histories series.",62cfdefb-9b9a-4039-980b-ef8048fb0c1b,ced3af6c-fa7c-43a0-98a3-9a0be2bb2b46,relators:ivr:6f48e9d9-cde2-4bf6-8257-b73d2f1de9b6||relators:ive:402ff850-3892-4326-a9cd-82c57586f81a,b13a7bd3-36ed-4838-a661-d2edd4c7924e,5fde104c-f1d8-440d-8578-ff28c1a9fbd0,558304c7-bb93-46e9-aee2-940aedf680bc||4bda73c2-1ed7-430a-9558-895be5ae119e,c5437b6e-77d8-4a23-9dc9-f549b5a4f9aa,58248e1c-533b-45b2-85c7-a0bf0751e855,2d0d469a-4ae1-470c-93cf-c912f430e20c,e3196586-4f7e-4373-a2f6-e5fb4d48621f,7c84ddc6-ad1d-4fe8-a4ee-2cf1bdcea33d||90de57a9-34d2-4a57-8446-83887f13da6d,10c269d7-9192-4ccb-8817-19d0a947fc97||a1c2bd9b-ed27-4f3c-a05e-0cd9ab24a074||fb99949c-528b-455c-9fb5-da669ee65795||52df55ce-3396-4108-9ee2-9d704372c10c||6b956982-9bf8-4d66-98ca-c67f9caa39e6||b28bae3f-6c38-48a0-8977-ca7a1a0dfb6a||175a6734-3921-4afa-a538-7b19d890be63||104f1e39-2840-4443-83f8-335486c31846||ae8f134f-c4a6-4e50-94a1-25de05c9a42c||05ebdcec-65c4-4cb3-a089-ac3df39cb652||402ff850-3892-4326-a9cd-82c57586f81a||4eec718c-edf8-44fc-93ae-8ac6a4c87acd||d1f0efe5-3f6a-4a41-accc-c54e95b343d3||1b8aa596-937a-4b35-873f-0dde9299f8b8||71365c1e-d34c-4b2e-876e-7e49b6861143||cf7ee7a7-35b5-4c8e-bb23-8fdcc06efcc1||3bea30c8-41d6-4d2c-b55d-4848b5c0bed5||55b647b8-8cba-4f53-b096-b310ec1f0c78||09ace68b-3a93-4cde-9120-3d223b3514c7||6d88194a-0dc1-48b4-96c2-ebe700e8ef26||40bd6d00-22b8-4cb4-95fc-03c1e18977c4||36d595b8-f33a-44c5-b14d-fb9219b5dfe8||413bba14-1ea5-40a6-bbc3-b741ec7cbe53||56ab53ef-16d6-477f-83fd-411c86ade0d5,c5437b6e-77d8-4a23-9dc9-f549b5a4f9aa,,,
https://digital.library.jhu.edu/node/102,0c2e4a2a-eceb-4d90-b1ce-cc88c6a41b5d,en,2022-03-11T14:37:38+00:00,True,Oral history of C.S.,2022-03-11T14:37:38+00:00,2022-03-11T14:37:38+00:00,True,True,True,und,MS.0404,2020-08-28,2020-03-04,8e1b6cc1-c01e-48b2-a978-e11d6640ed22,00:47:47 hh:mm:ss,https://aspace.library.jhu.edu/repositories/3/resources/400,9bd3ff1c-a007-4a27-ae50-31a7b701a9b4,"“C.S.” is a member of the Johns Hopkins University graduating class of 2020. In this interview, he describes growing up in Miami after immigrating to the United States from Cuba as a young child. He discusses how he prepared for college in high school and his experience with the Hop-In Program at Johns Hopkins. C.S. also shares about his academic experience as a triple major in psychology, romance languages, and Spanish with a minor in women, gender, and sexuality.",62cfdefb-9b9a-4039-980b-ef8048fb0c1b,ced3af6c-fa7c-43a0-98a3-9a0be2bb2b46,relators:ivr:c0a21523-f577-46f7-ac1d-034d7571b3e1||relators:ive:125747a7-c444-47a6-8fe1-9a47aacc1d42,b13a7bd3-36ed-4838-a661-d2edd4c7924e,5fde104c-f1d8-440d-8578-ff28c1a9fbd0,558304c7-bb93-46e9-aee2-940aedf680bc||4bda73c2-1ed7-430a-9558-895be5ae119e,c5437b6e-77d8-4a23-9dc9-f549b5a4f9aa,58248e1c-533b-45b2-85c7-a0bf0751e855,2d0d469a-4ae1-470c-93cf-c912f430e20c,e3196586-4f7e-4373-a2f6-e5fb4d48621f,7c84ddc6-ad1d-4fe8-a4ee-2cf1bdcea33d||90de57a9-34d2-4a57-8446-83887f13da6d,125747a7-c444-47a6-8fe1-9a47aacc1d42||53868075-0b78-4788-bedb-8d8b20d21922||7a04749b-40c5-4edd-aa7d-b89db0bb0905||fb99949c-528b-455c-9fb5-da669ee65795||5a366053-b4c6-4d1d-888c-bcc011cde308||4bb91c42-6923-4a57-885c-9317eff0b3cc||cbfec7f6-55c4-45c9-938e-67008f29ff9e||58b177ea-fb9f-4d25-b4d4-2f05c57d7971||e299cf70-dcdc-46a1-a58a-ac311e5213ca||0bfba326-42fa-4577-a5e5-4942ea25b7fc||ec47c3e7-bdc0-4b14-bf09-622109afe752||4937ecbf-c936-485f-bc0a-b04a8c6c5145||e36ab271-e88f-4598-b342-ad15f4c7314e||f639676d-fa5e-45a0-af90-8f2024d97230||16594e1b-162c-44e0-9902-80fcc23cdce1||779d3100-57c1-4871-b3de-e6b583aa6619,c5437b6e-77d8-4a23-9dc9-f549b5a4f9aa,,,
https://digital.library.jhu.edu/node/103,aacc7404-8283-4150-8092-bfa9fdf645e9,en,2022-03-11T14:37:38+00:00,True,Oral history of Greg Ball,2022-03-11T14:37:38+00:00,2022-03-11T14:37:38+00:00,True,True,True,und,MS.0404,2015-10-26,2014-06-16,8fc3536f-478e-4572-b326-109418c94724,01:01:23 hh:mm:ss,https://aspace.library.jhu.edu/repositories/3/resources/400,5c552a05-c8d2-4457-b60e-216def3400aa,"Gregory Ball was a professor in the Department of Psychological and Brain Sciences at Johns Hopkins University and also served as Vice Dean for Science and Research Infrastructure in the Krieger School of Arts and Sciences. He played a major role in the creation of the neuroscience undergraduate major in the 1990s. In 2014, he was appointed Dean of the College of Behavioral and Social Sciences (BSOS) at the University of Maryland, College Park. In this interview, Ball discusses the history of the department of Psychological and Brain Sciences and its relationship to other parts of the university. This oral history is part of the Hopkins Retrospective oral histories series.",62cfdefb-9b9a-4039-980b-ef8048fb0c1b,ced3af6c-fa7c-43a0-98a3-9a0be2bb2b46,relators:ivr:f92d4481-ca44-421d-aa4d-b96f4e1d97e8||relators:ive:6742028d-716c-4ce6-b806-71518d33ecdf,b13a7bd3-36ed-4838-a661-d2edd4c7924e,5fde104c-f1d8-440d-8578-ff28c1a9fbd0,558304c7-bb93-46e9-aee2-940aedf680bc||4bda73c2-1ed7-430a-9558-895be5ae119e,c5437b6e-77d8-4a23-9dc9-f549b5a4f9aa,58248e1c-533b-45b2-85c7-a0bf0751e855,2d0d469a-4ae1-470c-93cf-c912f430e20c,e3196586-4f7e-4373-a2f6-e5fb4d48621f,7c84ddc6-ad1d-4fe8-a4ee-2cf1bdcea33d||90de57a9-34d2-4a57-8446-83887f13da6d,fb99949c-528b-455c-9fb5-da669ee65795||6b956982-9bf8-4d66-98ca-c67f9caa39e6||6742028d-716c-4ce6-b806-71518d33ecdf||156783f0-28a5-42f6-86d5-cfa662fa0ae2||a375ff1c-d2d2-4d90-a6f5-433d2182da6c||d90770a0-354f-47f4-b2e9-9796b82027a3||d870d96e-2571-4284-9164-292cf4ca5891||edeecb03-4995-414a-b556-30bd5413dff1||f71eadf0-14fb-4c64-8f49-e9865220c493||599327ad-3444-46bc-afe2-a8c7db60a5b5||cf82800f-89ef-4a7d-bd6c-e45aead4c0ff||68869ef3-08a3-4d3f-bf2c-f5630fa8fda1||e633badd-0783-48a7-b789-1ed7f6eb77d4||05f29669-4c50-4308-aaa7-e947276e500f||3f9ff03f-ba77-4516-9d05-cba0440b1527||35d0cf4b-ff47-4637-b9ca-e0851dfb90b6||ab013ab4-ae58-4f62-8720-4d3ccb47aadc||2b04073e-9a48-471b-b476-3264932f9516||2d2acfca-33e2-416b-beff-2eea0666a7e7||5a70e10a-dd3c-456f-b2b9-ff4f683ff620,c5437b6e-77d8-4a23-9dc9-f549b5a4f9aa,,,
https://digital.library.jhu.edu/node/104,f9ec9641-3a83-49b0-b1b9-0cd1293edbd0,en,2022-03-11T14:37:38+00:00,True,Oral history of Forrest Tobey,2022-03-11T14:37:38+00:00,2022-03-11T14:37:38+00:00,True,True,True,und,MS.0404,2015-09-10,2000-03-21,924290bf-6755-4b38-ac72-8eb0b01e1556,00:57:48 hh:mm:ss,https://aspace.library.jhu.edu/repositories/3/resources/400,0392d748-4dc0-4ef6-a38f-bbe1bd53d580,"Forrest Tobey is a composer, conductor, and a double-degree graduate of the Peabody Institute. He is best known as a computer music artist, and created the Virtual Orchestra software. His compositions were played in Times Square on New Year's Eve of 2000. In this history, Tobey discusses his career as a conductor, music, and the Peabody Institute. This oral history is part of the Mame Warren oral histories series.",62cfdefb-9b9a-4039-980b-ef8048fb0c1b,ced3af6c-fa7c-43a0-98a3-9a0be2bb2b46,relators:ivr:8d255a4c-ff1e-411b-86c4-a2614e41cbcc||relators:ive:58d6a74e-2534-4641-a45c-2da5caded93e,b13a7bd3-36ed-4838-a661-d2edd4c7924e,5fde104c-f1d8-440d-8578-ff28c1a9fbd0,558304c7-bb93-46e9-aee2-940aedf680bc||4bda73c2-1ed7-430a-9558-895be5ae119e,c5437b6e-77d8-4a23-9dc9-f549b5a4f9aa,58248e1c-533b-45b2-85c7-a0bf0751e855,2d0d469a-4ae1-470c-93cf-c912f430e20c,e3196586-4f7e-4373-a2f6-e5fb4d48621f,7c84ddc6-ad1d-4fe8-a4ee-2cf1bdcea33d||90de57a9-34d2-4a57-8446-83887f13da6d,a60cc407-6383-4dce-8005-981bc0cd070b||d31cc01c-6297-4409-ba84-8ba99149ba48||99957a98-b272-45d1-ba29-20901f238bf6||b48c9b40-a169-4a67-a0dd-6d68ee314407||175a6734-3921-4afa-a538-7b19d890be63||46b82386-2560-4fa0-9ff1-011b41501088||543b6787-69bc-4f25-a476-d3800a418c06||486770d3-7886-4815-8af3-a51445f186d3||6dd69e66-c9f2-47e7-a2ee-59ac8e2336a5||58d6a74e-2534-4641-a45c-2da5caded93e||21b1d539-8b6b-436e-b67f-f1247d7ea95b||3bc5317f-eac0-49b0-8267-9f5897243870||291eefa4-97b6-466f-85d3-6c9d9e544ba9||cd94f1fd-def7-4dd6-b662-b0ba140e3cc2||edd0b09d-9311-44c1-8a0f-987c2306532b||c409289d-249a-4989-9952-210bee52dde0||16d4eff0-772e-47da-beee-3fc519cf0253||a3f4714c-40ea-4f21-9017-199c79a35323||21b886fc-e8f1-4081-bf17-7c213122ecfe||3c336352-e6bb-4772-9f32-70bf74b1a998,c5437b6e-77d8-4a23-9dc9-f549b5a4f9aa,,,
https://digital.library.jhu.edu/node/105,1cd6a18f-5d79-4389-b430-3fe6815b6f68,en,2022-03-11T14:37:38+00:00,True,Oral history of Barbara Bonnell,2022-03-11T14:37:38+00:00,2022-03-11T14:37:38+00:00,True,True,True,und,MS.0404,2015-08-10,1999-07-12,938589c6-91c3-46ab-91c0-7ae38ffa36ad,01:46:38 hh:mm:ss,https://aspace.library.jhu.edu/repositories/3/resources/400,6e13bdb5-821c-49af-a8a7-cb7e6d8d664d,"Barbara Bonnell attended Wellesley College and was a Fulbright scholar before coming to Hopkins in 1953 for her M.A. in international relations. She was deputy director of the Greater Baltimore Committee in the 1950s and director of information for Charles Center-Inner Harbor Management. She was also the first Baltimore native to become the president of the Association of Junior Leagues of America, in 1962. In this oral history, Bonnell discusses being a female graduate student and instructor on campus in the 1950s, undertaking research with Professor Malcolm Moos, McCarthyism, and community organizing in Baltimore. This oral history is part of the Mame Warren oral histories series.",62cfdefb-9b9a-4039-980b-ef8048fb0c1b,ced3af6c-fa7c-43a0-98a3-9a0be2bb2b46,relators:ivr:8d255a4c-ff1e-411b-86c4-a2614e41cbcc||relators:ive:28b4a33d-8159-4a0c-bfe2-e0646a45272f,b13a7bd3-36ed-4838-a661-d2edd4c7924e,5fde104c-f1d8-440d-8578-ff28c1a9fbd0,558304c7-bb93-46e9-aee2-940aedf680bc||4bda73c2-1ed7-430a-9558-895be5ae119e,c5437b6e-77d8-4a23-9dc9-f549b5a4f9aa,58248e1c-533b-45b2-85c7-a0bf0751e855,2d0d469a-4ae1-470c-93cf-c912f430e20c,e3196586-4f7e-4373-a2f6-e5fb4d48621f,7c84ddc6-ad1d-4fe8-a4ee-2cf1bdcea33d||90de57a9-34d2-4a57-8446-83887f13da6d,2e369d47-bd30-4f7d-847a-3fd557ccac4b||275aa6d1-abd4-479a-84c9-b5791d9e3cc1||9bab16ff-d5d1-4fc2-b772-e87df21968eb||393a85b8-66cc-40e2-b949-2f7ac1f883c2||fb99949c-528b-455c-9fb5-da669ee65795||28b4a33d-8159-4a0c-bfe2-e0646a45272f||c780d51b-bcaf-4a59-8ab5-0d6497d0d436||de68caa9-6a4a-4605-9457-0d8652743cfe||ae4d04f7-970b-4140-ae05-0331b3e4a8de||bfd0c5d3-a9c7-40af-bc11-d40165556bf6||231f06c1-c6a2-4071-9e7f-d8c823dd6461||4bb91c42-6923-4a57-885c-9317eff0b3cc||e947b057-5c0d-4856-aeb9-f176190831c1||49b70c66-50d2-48c3-a3b1-7d70d7b708dd||88e372ad-f2ac-4f9f-a7b4-2070da28dc40||305908aa-7132-4900-9751-2099e6f3fd9a||36d595b8-f33a-44c5-b14d-fb9219b5dfe8||2347774a-b493-4bd5-8d6f-d55c73dd65cb||1f3f14b3-80a9-4325-b7b2-2fdf8b2510e7||4ca5a287-ab3b-4d42-9b72-8308466dc410,c5437b6e-77d8-4a23-9dc9-f549b5a4f9aa,,,
https://digital.library.jhu.edu/node/106,5d4f46f1-56fc-488b-8f5e-519fd4199f42,en,2022-03-11T14:37:38+00:00,True,Oral history of William Banks,2022-03-11T14:37:38+00:00,2022-03-11T14:37:38+00:00,True,True,True,und,MS.0404,2015-08-05,1999-07-16,983252a4-fc3a-4363-9806-ae3f610bf816,00:55:18 hh:mm:ss,https://aspace.library.jhu.edu/repositories/3/resources/400,3f9f3f5f-6336-4f73-bf19-d895c5d0507f,"William Banks, a Baltimore native, received his B.A. from Johns Hopkins in 1929. Shortly after graduating, he joined the Lord Baltimore Press, a company specializing in folded paper boxes with brightly colored advertisements. A booming success, the business was bought by International Paper Co., of which Banks became the vice president in 1969. In this oral history, Banks describes what Hopkins was like in the 1920s, as well as his activities with the Black and Blue Jay and Barnstormers. Banks also discusses his favorite classes at Hopkins as well as fundraising for the university as an alumnus. This oral history is part of the Mame Warren oral histories series.",62cfdefb-9b9a-4039-980b-ef8048fb0c1b,ced3af6c-fa7c-43a0-98a3-9a0be2bb2b46,relators:ivr:8d255a4c-ff1e-411b-86c4-a2614e41cbcc||relators:ive:46356080-d4c8-4685-99d3-a482251410e1,b13a7bd3-36ed-4838-a661-d2edd4c7924e,5fde104c-f1d8-440d-8578-ff28c1a9fbd0,558304c7-bb93-46e9-aee2-940aedf680bc||4bda73c2-1ed7-430a-9558-895be5ae119e,c5437b6e-77d8-4a23-9dc9-f549b5a4f9aa,58248e1c-533b-45b2-85c7-a0bf0751e855,2d0d469a-4ae1-470c-93cf-c912f430e20c,e3196586-4f7e-4373-a2f6-e5fb4d48621f,7c84ddc6-ad1d-4fe8-a4ee-2cf1bdcea33d||90de57a9-34d2-4a57-8446-83887f13da6d,20e37519-12fd-4173-a15e-b009333465f9||fb99949c-528b-455c-9fb5-da669ee65795||3f0fb1ad-630c-423e-b6f2-2b451d475b3e||408cd16c-0197-471c-83f9-c17c328a85a0||689051af-d9a3-4f49-a9f2-9375c92033ec||d31cc01c-6297-4409-ba84-8ba99149ba48||e36ab271-e88f-4598-b342-ad15f4c7314e||35185ca9-392c-402f-9ec8-d8cb4a29d010||6913792a-482d-48bc-934b-5cb68238fc89||46356080-d4c8-4685-99d3-a482251410e1||79847e84-e203-4db7-994d-f60949b0c400||175a6734-3921-4afa-a538-7b19d890be63||0998f8f5-9f77-4413-bf3c-47e87e5a7b2f||2b19e54d-61e9-4c37-ae94-81fc2c0fbe0e||5314917c-e186-4162-937b-ed01650bf87e||d1e9c137-8f38-4404-84a1-4b0cd64742f2||b8716d8d-3b11-4b25-bfca-667bb3cba24b||c3aa7441-78d6-44f7-bea8-8f65d75b77f5||5e459fa1-4671-4b9e-ab68-b4390625ca64||cbfec7f6-55c4-45c9-938e-67008f29ff9e||ddc46830-e7c4-42e0-8fa7-e1ceaa6cce8b||1e4f696b-b6ff-4d51-8aca-79e3d20ce835||9e546fb0-79e1-4137-b5b8-b881daca96e3||da66a781-773c-4a58-890f-45768b3ee00d||36d595b8-f33a-44c5-b14d-fb9219b5dfe8||8d96bfc5-eb08-4765-979a-8d296f418dd9,c5437b6e-77d8-4a23-9dc9-f549b5a4f9aa,,,
