url,uuid,langcode,revision_timestamp,status,title,created,changed,promote,default_langcode,revision_translation_affected,content_translation_source,field_collection_number,field_date_available,field_date_published,field_dspace_item_id,field_extent,field_finding_aid,field_unique_id,field_abstract,field_access_rights,field_access_terms,field_contributor,field_copyright_and_use,field_digital_publisher,field_genre,field_language,field_member_of,field_model,field_publisher_country,field_resource_type,field_subject,field_title_language,field_date_copyrighted,field_description,field_date_created
https://digital.library.jhu.edu/node/44,acbdad87-85b6-425c-bc46-7150e066edbe,en,2022-03-11T14:37:38+00:00,True,Oral history of Bob Scott,2022-03-11T14:37:38+00:00,2022-03-11T14:37:38+00:00,True,True,True,und,MS.0404,2015-09-10,2000-04-03,0476f88c-b6a5-4f93-b825-b238bf5b501d,01:15:54 hh:mm:ss,https://aspace.library.jhu.edu/repositories/3/resources/400,e3b40890-e0a8-4057-ab75-eb103e38ccb2,"Robert Scott attended Johns Hopkins University, where he lettered on the 1950 National Championship Lacrosse Team and was chosen as an Honorable Mention All-American midfielder in 1952. Scott went on to join the Army. Scott was best known for his coaching career at Hopkins, which began when he returned from the military. He coached seven National Championship teams and was subsequently inducted into the National Lacrosse Hall of Fame for his coaching abilities. In this interview, Scott talks about Hopkins lacrosse and his undergraduate years. This oral history is part of the Mame Warren oral histories series.",62cfdefb-9b9a-4039-980b-ef8048fb0c1b,ced3af6c-fa7c-43a0-98a3-9a0be2bb2b46,relators:ivr:8d255a4c-ff1e-411b-86c4-a2614e41cbcc||relators:ive:43da7957-40c7-4399-98c2-ef1eff0a2c6c,b13a7bd3-36ed-4838-a661-d2edd4c7924e,5fde104c-f1d8-440d-8578-ff28c1a9fbd0,558304c7-bb93-46e9-aee2-940aedf680bc||4bda73c2-1ed7-430a-9558-895be5ae119e,c5437b6e-77d8-4a23-9dc9-f549b5a4f9aa,58248e1c-533b-45b2-85c7-a0bf0751e855,2d0d469a-4ae1-470c-93cf-c912f430e20c,e3196586-4f7e-4373-a2f6-e5fb4d48621f,7c84ddc6-ad1d-4fe8-a4ee-2cf1bdcea33d||90de57a9-34d2-4a57-8446-83887f13da6d,fb99949c-528b-455c-9fb5-da669ee65795||16ec9e74-ff78-4724-9a9c-dc559b3ec9c4||175a6734-3921-4afa-a538-7b19d890be63||de68caa9-6a4a-4605-9457-0d8652743cfe||77dc06ca-d197-4e44-977b-5ebeb75b8c72||8dcb8645-97f8-47af-83fe-a67397523854||43da7957-40c7-4399-98c2-ef1eff0a2c6c||cb43e5f1-8ebb-40d1-b86d-9265330b2322||4e5fe363-93e6-47d2-a0b0-cb7875394b14||236f840b-74b4-4635-8026-ca5d3e8bde31||cbfec7f6-55c4-45c9-938e-67008f29ff9e||da66a781-773c-4a58-890f-45768b3ee00d||5bf0c104-a831-41f5-9b6d-2586b6015aec||55374fa0-64bd-47f0-8b61-33ccf4a747e7||9434a1e1-4928-430d-bea2-6dd53e9290f0||85947022-6a54-4616-a33e-96fdb3666bfc||36d595b8-f33a-44c5-b14d-fb9219b5dfe8||8ba72106-c180-403d-81fd-02234132e515,c5437b6e-77d8-4a23-9dc9-f549b5a4f9aa,,,
https://digital.library.jhu.edu/node/45,7b30c7aa-2d1d-44fa-ba5e-2f0ab862fec4,en,2022-03-11T14:37:38+00:00,True,Oral history of Samuel Hopkins,2022-03-11T14:37:38+00:00,2022-03-11T14:37:38+00:00,True,True,True,und,MS.0404,2017-11-20,2006-05-10,075913e0-83f8-435a-9212-950f5290e455,01:26:41 hh:mm:ss,https://aspace.library.jhu.edu/repositories/3/resources/400,63384535-9570-473f-9260-dcaa2d919d99,"Samuel Hopkins was a Baltimore businessman, and advocate for preservation of Maryland historic sites. Hopkins was born and raised in Howard County and graduated from Johns Hopkins University in 1934. He was the great grand nephew of Johns Hopkins. Hopkins was active in politics and philanthropy in Maryland, and served as president of the Maryland Historical Society from 1970 to 1976. In this oral history, Hopkins describes his family’s history and impact on the city of Baltimore, describing Johns Hopkins career and relationships with contemporaries such as Enoch Pratt, Moses Sheppard, and George Peabody. Hopkins also discusses life on campus during his time as a student during the Great Depression, describing his relationships with prominent faculty members such as Dr. Frederic Chapin Lane and Dr. Broadus Mitchell, as well as student organizations and activities. This oral history is a part of the Mame Warren oral histories series.",62cfdefb-9b9a-4039-980b-ef8048fb0c1b,ced3af6c-fa7c-43a0-98a3-9a0be2bb2b46,relators:ivr:8d255a4c-ff1e-411b-86c4-a2614e41cbcc||relators:ive:bffd9e32-a27b-47e2-b096-0d24a3304e29,b13a7bd3-36ed-4838-a661-d2edd4c7924e,5fde104c-f1d8-440d-8578-ff28c1a9fbd0,558304c7-bb93-46e9-aee2-940aedf680bc||4bda73c2-1ed7-430a-9558-895be5ae119e,c5437b6e-77d8-4a23-9dc9-f549b5a4f9aa,58248e1c-533b-45b2-85c7-a0bf0751e855,2d0d469a-4ae1-470c-93cf-c912f430e20c,e3196586-4f7e-4373-a2f6-e5fb4d48621f,7c84ddc6-ad1d-4fe8-a4ee-2cf1bdcea33d||90de57a9-34d2-4a57-8446-83887f13da6d,9a20992d-4490-4133-b4cc-840bff26440f||bffd9e32-a27b-47e2-b096-0d24a3304e29||91d1f97d-b7fe-413b-9052-b2c76bf78b9a||fa080f1a-bca4-4a26-b8ac-554725b8c601||bbdc3d23-1649-4bce-8d20-7a2c5efcce7f||0271d93b-550f-428a-b4c2-59fcaef0668a||3a4aae4d-a06b-4b57-a34d-f5f62f92ff68||f38a0d3d-fb83-42bc-8a44-83d2f3888fde||432ba833-c182-42fa-b4fd-eeb0907bb6e4||ca9ac9bb-51fa-4f32-b89d-09d9d4c5e699||0045c8d6-e3c5-4adb-8fe7-97605c33e73a||2fa3fdce-9055-4c01-a0aa-4ebff36b1691||fb99949c-528b-455c-9fb5-da669ee65795||2b19e54d-61e9-4c37-ae94-81fc2c0fbe0e||ded8bd44-0676-4806-ae43-5fc1fc662ffd||e36ab271-e88f-4598-b342-ad15f4c7314e||cff1fe09-2512-4437-8547-ecc5c2ee85a4||e8c6a366-69a9-47ed-8002-bbd8ad7da814||47427563-60f0-4375-9b3f-954d3b78a883||87cd2e27-01f7-430f-8132-beed7d53e2b4||d0d10ed1-b686-4745-9595-339be06f4660||5317c70c-82c2-403e-9472-48c1d4ef07a6||36d595b8-f33a-44c5-b14d-fb9219b5dfe8||391ca083-9508-4efe-9cf7-212a9d8a2e98||9e9ae145-a5a4-4a61-a359-f0e53e1bab5a||2347dd9b-6d71-459a-a687-1413f9b1d6b4||e688c8e1-47a3-4230-9288-5af495832aa1||78621059-3357-4f21-98c2-f9bf56066404||8e823526-b657-484f-845d-1b664737ef07||2a681277-4a19-46c5-8e77-c8fc1a22eee8||cbfec7f6-55c4-45c9-938e-67008f29ff9e||a1b757ed-8491-4310-b234-8d244c11d577,c5437b6e-77d8-4a23-9dc9-f549b5a4f9aa,,,
https://digital.library.jhu.edu/node/46,c5ac045c-a9f6-4a80-b1c4-a8c37407fe5c,en,2022-03-11T14:37:38+00:00,True,Oral history of Edward Magruder Passano,2022-03-11T14:37:38+00:00,2022-03-11T14:37:38+00:00,True,True,True,und,MS.0404,2015-09-10,1999-12-13,094abaa7-c2ed-442b-832f-80b03cfe1405,00:53:17 hh:mm:ss,https://aspace.library.jhu.edu/repositories/3/resources/400,afb59a47-ea2b-41ee-b41c-87c958985b0b,"Edward ""Mac"" Magruder Passano was born in Baltimore, Maryland. He earned both an undergraduate (1967) and graduate (1969) degree from Johns Hopkins University. He is the CEO of One Waverly LLC, a philanthropic consulting firm and participates in a variety of other philanthropic endeavors. These include his position as chairman of the Passano Foundation and his position as a board member at the Baltimore Economy and Efficiency foundation, the Pride of Baltimore, and the Board of Visitors of the University of Maryland School of Medicine. In 2001, Passano, along with his wife and three daughters, received the Philanthropist of the Year award from the Association of Fundraising Professionals. In this interview, Passano discusses his time at the Johns Hopkins School of Professional Studies in business and education as well as his philanthropic endeavors. This oral history is a part of the Mame Warren oral histories series.",62cfdefb-9b9a-4039-980b-ef8048fb0c1b,ced3af6c-fa7c-43a0-98a3-9a0be2bb2b46,relators:ivr:8d255a4c-ff1e-411b-86c4-a2614e41cbcc||relators:ive:a6fa6a80-f3be-4426-a2cf-eaae9ad87fab,b13a7bd3-36ed-4838-a661-d2edd4c7924e,5fde104c-f1d8-440d-8578-ff28c1a9fbd0,558304c7-bb93-46e9-aee2-940aedf680bc||4bda73c2-1ed7-430a-9558-895be5ae119e,c5437b6e-77d8-4a23-9dc9-f549b5a4f9aa,58248e1c-533b-45b2-85c7-a0bf0751e855,2d0d469a-4ae1-470c-93cf-c912f430e20c,e3196586-4f7e-4373-a2f6-e5fb4d48621f,7c84ddc6-ad1d-4fe8-a4ee-2cf1bdcea33d||90de57a9-34d2-4a57-8446-83887f13da6d,fb99949c-528b-455c-9fb5-da669ee65795||1b20c35d-d5b6-4853-8414-a721c0c7d145||76e05005-58ca-41d9-9541-6b145269d4e5||dc2b717a-8cf6-4515-8970-c0f231a48cb7||e36ab271-e88f-4598-b342-ad15f4c7314e||7d63e6b3-5d50-48d4-a76b-7e7e18829fb6||a6fa6a80-f3be-4426-a2cf-eaae9ad87fab||3459eaab-3638-4d4a-8056-2a05451ee31b||fa05fd91-098c-4999-a379-02cf72927869||3a282ead-b69f-43b1-872a-9fa864c42c08||36d595b8-f33a-44c5-b14d-fb9219b5dfe8||2347774a-b493-4bd5-8d6f-d55c73dd65cb,c5437b6e-77d8-4a23-9dc9-f549b5a4f9aa,,,
https://digital.library.jhu.edu/node/47,b984187f-392d-4f37-8ba5-3a9340ef0511,en,2022-03-11T14:37:38+00:00,True,Oral history of David Cohen,2022-03-11T14:37:38+00:00,2022-03-11T14:37:38+00:00,True,True,True,und,MS.0404,2017-06-30,2015-12-16,0e310885-603d-4e07-aff7-6e8e364a309d,01:03:45 hh:mm:ss,https://aspace.library.jhu.edu/repositories/3/resources/400,18344c78-a94f-4d9b-8986-82ec70bc8f5b,"Dr. David Cohen is currently Emeritus Professor of History and Anthropology at the University of Michigan. While completing his Ph.D. in African history at the University of London, he joined the Johns Hopkins History Department in 1968. Along with Jack Greene, Cohen helped to establish the Atlantic Program in History and Culture, which combined historical and anthropological approaches to the study of the Americas, Europe, and Africa. Cohen describes borrowing from Philip Curtin's tropical history program at the University of Wisconsin, working with Greene, Sidney Mintz, and Richard Price, the influence of Clifford Geertz, and the Atlantic Program as an institutional and intellectual model for similar programs adopted at other universities. This oral history is part of the Hopkins Retrospective oral histories series.",62cfdefb-9b9a-4039-980b-ef8048fb0c1b,ced3af6c-fa7c-43a0-98a3-9a0be2bb2b46,relators:ivr:f92d4481-ca44-421d-aa4d-b96f4e1d97e8||relators:ive:a41c0f3d-b100-4e92-b6a2-86980b22bf4b,b13a7bd3-36ed-4838-a661-d2edd4c7924e,5fde104c-f1d8-440d-8578-ff28c1a9fbd0,558304c7-bb93-46e9-aee2-940aedf680bc||4bda73c2-1ed7-430a-9558-895be5ae119e,c5437b6e-77d8-4a23-9dc9-f549b5a4f9aa,58248e1c-533b-45b2-85c7-a0bf0751e855,2d0d469a-4ae1-470c-93cf-c912f430e20c,e3196586-4f7e-4373-a2f6-e5fb4d48621f,7c84ddc6-ad1d-4fe8-a4ee-2cf1bdcea33d||90de57a9-34d2-4a57-8446-83887f13da6d,e0e58c63-f727-4f95-a444-1a7a4bae2347||fb99949c-528b-455c-9fb5-da669ee65795||dbca64e7-a3e8-4960-b888-1b7c4932e12e||d873f99b-b8c1-402e-9f0e-d6946d1bbfba||9e9ae145-a5a4-4a61-a359-f0e53e1bab5a||6c88355a-4cb8-4120-843f-5f7fddc29407||4703a5bb-3952-46a3-9969-b32a8d7964a9||137b6581-3ed3-4321-bde5-9d538b66107b||d3f5e546-eb73-4c92-94b9-13aaa9fef4fd||b95399a7-c2f4-42a3-8cf5-d298f20a1193||bbdc3d23-1649-4bce-8d20-7a2c5efcce7f||e36ab271-e88f-4598-b342-ad15f4c7314e||61121d85-a2b6-4a25-a4c3-022c8184275c,c5437b6e-77d8-4a23-9dc9-f549b5a4f9aa,,,
https://digital.library.jhu.edu/node/48,7771c641-72bb-4a38-adf7-aff28a3c8bcd,en,2022-03-11T14:37:38+00:00,True,Oral history of Howard Dintzis and Renee Dintzis,2022-03-11T14:37:38+00:00,2022-03-11T14:37:38+00:00,True,True,True,und,MS.0404,2016-09-09,2014-11-17,14c3aea2-568a-4bfe-83ca-a24cd6a9a827,01:33:09 hh:mm:ss,https://aspace.library.jhu.edu/repositories/3/resources/400,096088e3-1a35-426e-a9e2-0296b2bcaba2,"Howard Dintzis and Renee Dintzis were both longtime faculty members in the Johns Hopkins School of Medicine Department of Biophysics and Biophysical Chemistry. The husband and wife scientists first met in graduate school at Harvard. Prior to coming to Hopkins, their work brought them to Yale University, Cambridge University, the California Institute of Technology, and the Massachusetts Institute of Technology. In this oral history, Howard and Renee Dintzis discuss their life's work as scientists and some of their notable colleagues and students, including Francis Crick. Renee Dintzis also discusses balancing motherhood with her scientific career and the experience of being a woman in a male-dominated field. This oral history is part of the Hopkins Retrospective oral histories series.",62cfdefb-9b9a-4039-980b-ef8048fb0c1b,ced3af6c-fa7c-43a0-98a3-9a0be2bb2b46,relators:ivr:f92d4481-ca44-421d-aa4d-b96f4e1d97e8||relators:ive:d8bb679a-89aa-43ea-a100-841a60a9d999||relators:ive:84b6da87-08aa-4a6a-990a-a0550fae67ed,b13a7bd3-36ed-4838-a661-d2edd4c7924e,5fde104c-f1d8-440d-8578-ff28c1a9fbd0,558304c7-bb93-46e9-aee2-940aedf680bc||4bda73c2-1ed7-430a-9558-895be5ae119e,c5437b6e-77d8-4a23-9dc9-f549b5a4f9aa,58248e1c-533b-45b2-85c7-a0bf0751e855,2d0d469a-4ae1-470c-93cf-c912f430e20c,e3196586-4f7e-4373-a2f6-e5fb4d48621f,7c84ddc6-ad1d-4fe8-a4ee-2cf1bdcea33d||90de57a9-34d2-4a57-8446-83887f13da6d,d8775c60-f5d4-48bb-a21c-7d7d0b097635||983a4063-ecb3-42cc-8009-7f82fde989a5||81162529-a8dc-423d-8add-2071e1a60727||fb99949c-528b-455c-9fb5-da669ee65795||6dbbede9-429c-413f-a155-be5bc09c2205||6b956982-9bf8-4d66-98ca-c67f9caa39e6||e7f0c95b-4f62-4026-9596-52a2c59738b0||0690a9b3-e2de-4cb2-ac33-7105d491e918||5243a0a9-d751-4b36-adc5-92b4cbce234a||c6e65d17-d67c-45c7-9bd4-3ec352c3bda4||2f48d0dd-3647-4e6e-ade9-dc3c5dd27095||6eb59746-d1c4-4662-b531-b257de8f8256||72ce9e39-246d-4c15-9bd8-415717e37e8c||4efc40f1-58bd-40c4-bf58-7beacb44249f||3b724814-00e3-4e52-bb4f-efead4d923e2||3e3910dd-6f98-41fb-a599-2051a6a2f695||d8bb679a-89aa-43ea-a100-841a60a9d999||84b6da87-08aa-4a6a-990a-a0550fae67ed||e45941e4-d356-4b34-8422-1d391afac6b8||de68caa9-6a4a-4605-9457-0d8652743cfe||5b535f30-e780-4f12-9f5b-f134f00eeeea||6c0db5c5-fe34-4408-adc6-17da30855776||17a5b9eb-2bb2-4668-b617-1acf8078a5df||e2afd4a8-2b0e-4c4f-99b6-210a98c69734||fbf13352-9a67-497a-bbda-6d68146cadd8||36a8c19b-085f-4ea9-9853-eb00a04c4573||fca8e826-f6b2-4e80-8832-15808b423ead||f71eadf0-14fb-4c64-8f49-e9865220c493||0450b8ac-3dd6-4df0-a874-6ea33dcd1d11||a47f4754-477b-4b71-967c-a819a4e8c10b||847b5e4e-095e-486e-9203-3e88a59bac7f||e9fd07dc-f5c8-49d7-8b90-460508548440||6ec1bbd6-9076-4ce5-81f9-fe4ab30a0ac1||cedf6c35-5155-4b0e-99ff-5d33090a0fed||3a71c7b4-492f-44c9-901e-e6f62921a593||31152852-afd6-48af-9e1c-feeb2df07979||e1d387ac-e952-4a4a-8278-a9918e17d84a||ab708aa1-52f2-4efe-b53b-7ab488d7b42c||39f4bc97-5dfe-4587-b865-03894a6fe32d||cf7ee7a7-35b5-4c8e-bb23-8fdcc06efcc1||9f257fd5-ca3e-45c2-9890-efc15f2c84b1||88a27874-c94c-44f8-9ed6-c56bc702ee0a||43c7574d-d933-4898-a479-92089572fdcb||357802d5-3c85-4f68-a23a-6879d54b930b||82b318b6-fd53-44f8-93c3-0164c9a932cc||40bd6d00-22b8-4cb4-95fc-03c1e18977c4||c07c3c1a-1161-4d28-95a3-4bc47a361277||8d96bfc5-eb08-4765-979a-8d296f418dd9,c5437b6e-77d8-4a23-9dc9-f549b5a4f9aa,,,
https://digital.library.jhu.edu/node/49,b0bb7852-fa1c-41db-a42f-36e77a7d26ea,en,2022-03-11T14:37:38+00:00,True,Oral history of Eric Noji,2022-03-11T14:37:38+00:00,2022-03-11T14:37:38+00:00,True,True,True,und,MS.0404,2015-09-03,1999-07-27,16bdc9ad-0524-4276-95ae-1caa44317c30,01:40:38 hh:mm:ss,https://aspace.library.jhu.edu/repositories/3/resources/400,27d487a8-e1de-4093-8a8c-e90bb81d9611,"Eric Noji earned his undergraduate degree from Stanford University in 1977, having majored in biochemistry, philosophy, and classics. He went on to receive his MD from the University of Rochester School of Medicine and Dentistry and his MPH in Epidemiology from the Johns Hopkins Bloomberg School of Public Health. After spending time working as a US Park Police Ranger and marine wildlife biologist, he became an Assistant Professor of Emergency Medicine at Johns Hopkins Hospital and a Medical Epidemiologist at the CDC, among other positions. Dr. Noji is a prominent physician in the humanitarian community, and has been awarded such honors as his election to the Institute of Medicine of the US National Academies of Science as well as his induction into the Ordre des Palmes Académiques at the rank of Chevalier. In this history, Dr. Noji discusses his education and medical career as well as his time at Johns Hopkins. This oral history is part of the Mame Warren oral histories series.",62cfdefb-9b9a-4039-980b-ef8048fb0c1b,ced3af6c-fa7c-43a0-98a3-9a0be2bb2b46,relators:ivr:8d255a4c-ff1e-411b-86c4-a2614e41cbcc||relators:ive:7ac49967-e1aa-4c18-8804-e166f4dae093,b13a7bd3-36ed-4838-a661-d2edd4c7924e,5fde104c-f1d8-440d-8578-ff28c1a9fbd0,558304c7-bb93-46e9-aee2-940aedf680bc||4bda73c2-1ed7-430a-9558-895be5ae119e,c5437b6e-77d8-4a23-9dc9-f549b5a4f9aa,58248e1c-533b-45b2-85c7-a0bf0751e855,2d0d469a-4ae1-470c-93cf-c912f430e20c,e3196586-4f7e-4373-a2f6-e5fb4d48621f,7c84ddc6-ad1d-4fe8-a4ee-2cf1bdcea33d||90de57a9-34d2-4a57-8446-83887f13da6d,d80dd176-0e61-468e-807d-8c57597e1822||8314235f-b4dd-4c89-9ebf-a84b1ef7cb5e||7d167db2-2b3e-4bb9-91e4-b611272c04ac||6dbbede9-429c-413f-a155-be5bc09c2205||6b956982-9bf8-4d66-98ca-c67f9caa39e6||b28bae3f-6c38-48a0-8977-ca7a1a0dfb6a||aae37676-edd4-4172-9af3-3b199c576af3||08b45320-9919-45ac-91ed-8e8db2583238||cfe47105-4096-4267-8746-8ad98df4f41d||370a9a68-b5aa-4b04-8924-e2b217b1ea2f||dba0792f-9a04-4b76-b75d-aefaa388d665||5624a574-745f-47cc-a255-0e50a037547b||7ac49967-e1aa-4c18-8804-e166f4dae093||21af842a-7946-4224-849c-8cf26b7523db||13062bf2-fee4-4c76-8197-817d8050e868||6654dc35-31b0-496c-8639-3ee0c82de709||78c48371-9e37-48f8-a3cf-586059170688||222914a5-400e-4ec1-a780-6be8b7b3f867||f021acb3-eba6-48f5-894e-bc0e9194c784||af265f68-a11e-4464-8aaf-e701f61646af||e2bf4725-4a66-4fa1-8df6-a21f06d18852||09649bb1-e3b9-4095-9390-20c840713664||55512041-98a8-4db0-a0e7-2cf46e39ce95||3f399bba-9df6-4e2b-bac5-b4546ab0d3e8||44590efd-bf78-4505-888b-2a3173e28fd5||f7aa3385-23cb-4ca0-a7a5-d521d15e33a9||399110ba-5a55-40c0-a8b2-6b172e1525fc||e7bb6f72-56fb-4e45-99c5-fa902b7468a1||c482d522-b586-4ca0-8670-b1725c1a82e0||e2c169ae-bf0d-4fa8-92d7-d66b740eeb0a||926b222b-3b28-48fa-b668-09e303afd9b5||ff5d407a-65c5-47d7-98ef-b6478ef13e0c,c5437b6e-77d8-4a23-9dc9-f549b5a4f9aa,,,
https://digital.library.jhu.edu/node/50,01994d57-8b78-42a5-8377-2ecb02f3dab9,en,2022-03-11T14:37:38+00:00,True,Oral history of Donald Coffey,2022-03-11T14:37:38+00:00,2022-03-11T14:37:38+00:00,True,True,True,und,MS.0404,2015-08-10,2000-05-02,185d5fe6-4990-411b-a6ec-824beece3948,02:17:52 hh:mm:ss,https://aspace.library.jhu.edu/repositories/3/resources/400,96bf7cec-0d91-40b3-872a-ef4d2ef5944d,"Donald S. Coffey was born on October 10, 1932 in Bristol, Virginia. He attended King College there before transferring to the University of East Tennessee. In 1957, Coffey moved to Baltimore to work for Westinghouse, after which he took night classes at the Hopkins night school (McCoy College) and eventually began to work for the Johns Hopkins School of Medicine in the Brady Research Laboratory. This led Coffey to apply to the Department of Physiological Chemistry in the medical school for his graduate education. Coffey subsequently received his Ph.D. in 1964, became a professor of urology in the School of Medicine, and served as editor for many scholarly journals. In this oral history, Coffey discusses his early life, how he came to work at Hopkins, and his colleagues and work in the Johns Hopkins School of Medicine. This oral history is part of the Mame Warren oral histories series.",62cfdefb-9b9a-4039-980b-ef8048fb0c1b,ced3af6c-fa7c-43a0-98a3-9a0be2bb2b46,relators:ivr:8d255a4c-ff1e-411b-86c4-a2614e41cbcc||relators:ive:98246066-6e1e-47d1-a82a-1ad266dc1813,b13a7bd3-36ed-4838-a661-d2edd4c7924e,5fde104c-f1d8-440d-8578-ff28c1a9fbd0,558304c7-bb93-46e9-aee2-940aedf680bc||4bda73c2-1ed7-430a-9558-895be5ae119e,c5437b6e-77d8-4a23-9dc9-f549b5a4f9aa,58248e1c-533b-45b2-85c7-a0bf0751e855,2d0d469a-4ae1-470c-93cf-c912f430e20c,e3196586-4f7e-4373-a2f6-e5fb4d48621f,7c84ddc6-ad1d-4fe8-a4ee-2cf1bdcea33d||90de57a9-34d2-4a57-8446-83887f13da6d,74a0b7cf-337b-4d27-86e3-d1e6dbfafa81||6b956982-9bf8-4d66-98ca-c67f9caa39e6||5b4f05ac-3ed5-4523-b768-1a85f8ca63d4||e36ab271-e88f-4598-b342-ad15f4c7314e||29d35b2c-5e36-4ca7-bfdc-11fa18bd9d31||42b21f57-9fc4-41c6-a61a-769406289ab0||98246066-6e1e-47d1-a82a-1ad266dc1813||de68caa9-6a4a-4605-9457-0d8652743cfe||b8c5687d-34b3-4edb-9739-b549e8bb532f||48bf1d89-f3f4-4f07-9d1a-c3c84381174a||db6852a8-cdee-4b77-af6b-07d3b6fc9178||cedf6c35-5155-4b0e-99ff-5d33090a0fed||1b8aa596-937a-4b35-873f-0dde9299f8b8||9f8b8423-4c68-4bc8-8aea-0f8e6b91b849||d32599c2-d70d-4b1a-9ae4-a60928a2632c||302b1e58-86fe-4594-b96d-886f0c506dba||2285fa5d-3ebc-4f9d-a5c2-a940e619a80d||e0c4e24d-bc42-403d-8b61-624ef06bc2ab||b6ec18f8-8895-4c32-b47c-a4aaa1e926ce,c5437b6e-77d8-4a23-9dc9-f549b5a4f9aa,,,
https://digital.library.jhu.edu/node/51,c04d7942-7185-4ecd-b6ac-a0134e0bdca9,en,2022-03-11T14:37:38+00:00,True,Oral history of Neil Grauer,2022-03-11T14:37:38+00:00,2022-04-05T13:15:13+00:00,True,True,True,und,MS.0404,2015-08-31,1999-07-08,19e61c98-c885-4ebb-95a9-4c42b5a5fc8c,02:00:12 hh:mm:ss,https://aspace.library.jhu.edu/repositories/3/resources/400,85a603f9-261f-4dea-ad62-03ae4efed6a2,"Neil Grauer, born in 1947, is a journalist and editorial cartoonist who grew up in Great Neck, New York. Grauer received his B.A. from Johns Hopkins University in 1969 and a masters degree in journalism from Northwestern University in 1970. Grauer was a reporter and cartoonist for the Baltimore News- American from 1970 until 1980, after which he served as the public affairs officer in the Consumer Protection Division of the Maryland Attorney General's Office. In 1984, he published Wits and Sages which profiles twelve contemporary newspaper columnists. In 1988 his Drugs and the Law appeared as part of the Encyclopedia of Psychoactive Drugs. In this oral history, Grauer discusses his student days at Hopkins in the 1960s, including the political unrest of the time, his activities with the student body, and his work cartooning for the News-Letter. This oral history is part of the Mame Warren oral histories series. 
Due to a technical error with one of the audio cassettes, Grauer's oral history is only partially transcribed, with approximately one-fifth of the content missing from the transcript. The audio file contains the full recording.",62cfdefb-9b9a-4039-980b-ef8048fb0c1b,ced3af6c-fa7c-43a0-98a3-9a0be2bb2b46,relators:ivr:8d255a4c-ff1e-411b-86c4-a2614e41cbcc||relators:ive:6728f7c3-462b-461b-a833-ed702504be83,b13a7bd3-36ed-4838-a661-d2edd4c7924e,5fde104c-f1d8-440d-8578-ff28c1a9fbd0,558304c7-bb93-46e9-aee2-940aedf680bc||4bda73c2-1ed7-430a-9558-895be5ae119e,c5437b6e-77d8-4a23-9dc9-f549b5a4f9aa,58248e1c-533b-45b2-85c7-a0bf0751e855,2d0d469a-4ae1-470c-93cf-c912f430e20c,e3196586-4f7e-4373-a2f6-e5fb4d48621f,7c84ddc6-ad1d-4fe8-a4ee-2cf1bdcea33d||90de57a9-34d2-4a57-8446-83887f13da6d,6db9184e-b4d9-4d7a-a450-2a094e75769d||4c71c690-c7b0-4deb-a58e-3d4f96ce439d||a408cb46-24d4-41fe-9cf4-debe8f0d5105||fb99949c-528b-455c-9fb5-da669ee65795||11ab948c-7e85-4d2e-bdcd-ffb4096ddf3a||b79ba5a4-71d7-4168-a6df-5916993b39c0||0839ab75-757c-425a-9665-21a62bb878a8||175a6734-3921-4afa-a538-7b19d890be63||c2ebbb6d-c5ed-4fdf-8b92-0a0987ee3807||51d5a9d9-b145-4ce9-83ea-8bbed295cc9e||3721c5b3-576b-4b0e-b750-f00d0a3169f4||08b142c5-c4d7-42b7-9548-0c04e1dac328||de68caa9-6a4a-4605-9457-0d8652743cfe||6c0db5c5-fe34-4408-adc6-17da30855776||6728f7c3-462b-461b-a833-ed702504be83||cbeecd00-0e8d-497a-a953-dd9da193147a||c2ed6e53-994b-4573-b92c-14dde9af7247||d062efef-91ec-43ce-b1bb-1027e6cf8412||418d642d-3536-4b1c-bf07-595b68cd8dc7||07783c33-23e4-439f-9cf3-cc91c0eeb41d||ea9432fb-f4ee-4a46-8eec-ae836c8af765||1fad7e9e-4af1-42f3-942d-58eec0889cfb||cc39c578-5a91-4e67-a744-bd5db9ff8fae||b0c2889a-e716-415e-9554-150a91028b54||12e22ea9-c1bd-42c6-b1e1-f379f97db52a||30853cc9-c32c-4058-ae2a-fd493bcb6298||8175594a-8417-4ab8-b766-0874dc2b0132||b2dca9ed-6be0-47a5-b86f-3dd50cdb8a22||8cb8dead-a699-45aa-a8d7-565845bbf370||6359975d-62b5-4d11-a326-c074e32d1873||cbfec7f6-55c4-45c9-938e-67008f29ff9e||b173368d-a365-4164-bb63-fbedc941c869||922d992d-f77a-47c4-afb3-f30669fa510e||da66a781-773c-4a58-890f-45768b3ee00d||37ca7a85-adda-48ea-8f02-09b22006d242||872913cd-3816-4ec7-ba04-4daacc6ec696,c5437b6e-77d8-4a23-9dc9-f549b5a4f9aa,,,
